"Authors","Author full names","Author(s) ID","Title","Year","Source title","Volume","Issue","Art. No.","Page start","Page end","Page count","Cited by","DOI","Link","Document Type","Publication Stage","Open Access","Source","EID"
"Heinemann B.","Heinemann, Bernhard (7005188791)","7005188791","Regarding overlaps in 'topologic'","2006","Advances in Modal Logic 2006","6","","","259","277","18","6","","https://www.scopus.com/inward/record.uri?eid=2-s2.0-37349013903&partnerID=40&md5=19777f5f455211a9948f2f25696e7062","Conference paper","Final","","Scopus","2-s2.0-37349013903"
"Kurucz A.","Kurucz, Agi (8732161000)","8732161000","On axiomatising products of Kripke frames, part II","2008","Advances in Modal Logic 2006","7","","","219","230","11","6","","https://www.scopus.com/inward/record.uri?eid=2-s2.0-77956501692&partnerID=40&md5=2127303b828cd66433f8776e14ebe702","Conference paper","Final","","Scopus","2-s2.0-77956501692"
"Figueira S.; Gorín D.","Figueira, Santiago (10239550300); Gorín, Daniel (8889515700)","10239550300; 8889515700","On the size of shortest modal descriptions","2010","Advances in Modal Logic 2006","8","","","120","139","19","18","","https://www.scopus.com/inward/record.uri?eid=2-s2.0-79960129358&partnerID=40&md5=b424229b005f0348c8e3c06198c1f27b","Conference paper","Final","","Scopus","2-s2.0-79960129358"
"Kontinen J.; Múller J.-S.; Schnoor H.; Vollmer H.","Kontinen, Juha (12796382100); Múller, Julian-Steffen (57211135314); Schnoor, Henning (55885134600); Vollmer, Heribert (56055781600)","12796382100; 57211135314; 55885134600; 56055781600","Modal independence logic","2014","Advances in Modal Logic","10","","","353","372","19","20","","https://www.scopus.com/inward/record.uri?eid=2-s2.0-84924712707&partnerID=40&md5=28c442a1baf45c985ce55e5342fc7a0a","Conference paper","Final","","Scopus","2-s2.0-84924712707"
"Pentus M.","Pentus, Mati (16414824700)","16414824700","Complexity of the Lambek calculus and its fragments","2010","Advances in Modal Logic 2006","8","","","310","329","19","3","","https://www.scopus.com/inward/record.uri?eid=2-s2.0-84858664604&partnerID=40&md5=935510b28fe35781f56fe9e1fbd48ef7","Conference paper","Final","","Scopus","2-s2.0-84858664604"
"Kudinov A.; Shapirovsky I.; Shehtman V.","Kudinov, Andrey (55117642700); Shapirovsky, Ilya (8716184900); Shehtman, Valentin (16470280300)","55117642700; 8716184900; 16470280300","On modal logics of hamming spaces","2012","Advances in Modal Logic","9","","","395","410","15","1","","https://www.scopus.com/inward/record.uri?eid=2-s2.0-84906769466&partnerID=40&md5=6ab9cfde83294bce0279e6721a8396d0","Conference paper","Final","","Scopus","2-s2.0-84906769466"
"Tulenheimo T.; Sevenster M.","Tulenheimo, Tero (14042896500); Sevenster, Merlijn (55890883200)","14042896500; 55890883200","On modal logic, IF logic, and IF modal logic","2006","Advances in Modal Logic 2006","6","","","481","501","20","5","","https://www.scopus.com/inward/record.uri?eid=2-s2.0-62649163924&partnerID=40&md5=787112b44a251c9d2a7df4e65ef39ee4","Conference paper","Final","","Scopus","2-s2.0-62649163924"
"Kupke C.; Pattinson D.","Kupke, Clemens (6602390943); Pattinson, Dirk (6603022335)","6602390943; 6603022335","On modal logics of linear inequalities","2010","Advances in Modal Logic 2006","8","","","235","255","20","17","","https://www.scopus.com/inward/record.uri?eid=2-s2.0-84858639245&partnerID=40&md5=54c3695c4225a7e3e1d7806e177a62af","Conference paper","Final","","Scopus","2-s2.0-84858639245"
"Holliday W.H.; Icard III T.F.","Holliday, Wesley H. (36704582700); Icard III, Thomas F. (45561295100)","36704582700; 45561295100","Moorean phenomena in epistemic logic","2010","Advances in Modal Logic 2006","8","","","178","199","21","57","","https://www.scopus.com/inward/record.uri?eid=2-s2.0-80054057125&partnerID=40&md5=d3adc6b75d7cab4f6743546b00bf6ec9","Conference paper","Final","","Scopus","2-s2.0-80054057125"
"Van Ditmarsch H.; Fan J.; Van Der Hoek W.; Iliev P.","Van Ditmarsch, Hans (57215882990); Fan, Jie (56434947400); Van Der Hoek, Wiebe (7005925719); Iliev, Petar (24481404700)","57215882990; 56434947400; 7005925719; 24481404700","Some exponential lower bounds on formula-size in modal logic","2014","Advances in Modal Logic","10","","","139","157","18","10","","https://www.scopus.com/inward/record.uri?eid=2-s2.0-84924671231&partnerID=40&md5=3f43caf649380733487e57e7338bd34d","Conference paper","Final","","Scopus","2-s2.0-84924671231"
"Vakarelov D.","Vakarelov, Dimiter (6603656027)","6603656027","Dynamic mereotopology II: Axiomatizing some whiteheadean type space-time logics","2014","Advances in Modal Logic","9","","","538","558","20","7","","https://www.scopus.com/inward/record.uri?eid=2-s2.0-84906772761&partnerID=40&md5=577b82bdb5995119c2a1c466b0f0d609","Conference paper","Final","","Scopus","2-s2.0-84906772761"
"Kuusisto A.","Kuusisto, Antti (48861264200)","48861264200","A modal perspective on Monadic Second-Order alternation hierarchies","2008","Advances in Modal Logic 2006","7","","","231","247","16","7","","https://www.scopus.com/inward/record.uri?eid=2-s2.0-70349567067&partnerID=40&md5=7f972cad4151c457e36d064f0a622ae7","Conference paper","Final","","Scopus","2-s2.0-70349567067"
"Kashima R.","Kashima, Ryo (6602512324)","6602512324","Completeness proof by semantic diagrams for transitive closure of accessibility relation","2010","Advances in Modal Logic 2006","8","","","200","217","17","3","","https://www.scopus.com/inward/record.uri?eid=2-s2.0-84858685557&partnerID=40&md5=77bed3bb4de12ef332721e5710a65c55","Conference paper","Final","","Scopus","2-s2.0-84858685557"
"Goldblatt R.","Goldblatt, Robert (7003578942)","7003578942","A Kripke-Joyal semantics for noncommutative logic in quantales","2006","Advances in Modal Logic 2006","6","","","209","225","16","13","","https://www.scopus.com/inward/record.uri?eid=2-s2.0-69649087475&partnerID=40&md5=aa95bb76ada1556ad1395ee6c6d42c8f","Conference paper","Final","","Scopus","2-s2.0-69649087475"
"Brünnler K.","Brünnler, Kai (12142790300)","12142790300","Deep sequent systems for modal logic","2006","Advances in Modal Logic 2006","6","","","107","119","12","44","","https://www.scopus.com/inward/record.uri?eid=2-s2.0-62149093779&partnerID=40&md5=81e163662c74dbeead6ddcc30db0ce55","Conference paper","Final","","Scopus","2-s2.0-62149093779"
"Shapirovsky I.","Shapirovsky, Ilya (8716184900)","8716184900","PSPACE-decidability of Japaridze's Polymodal Logic","2008","Advances in Modal Logic 2006","7","","","289","304","15","22","","https://www.scopus.com/inward/record.uri?eid=2-s2.0-77349083035&partnerID=40&md5=c687b37d5ac783089e302d9b99a09563","Conference paper","Final","","Scopus","2-s2.0-77349083035"
"Konev B.; Wolter F.; Kontchakov R.; Zakharyaschev M.","Konev, Boris (6603374977); Wolter, Frank (7005739306); Kontchakov, Roman (23008721700); Zakharyaschev, Michael (6602982360)","6603374977; 7005739306; 23008721700; 6602982360","Dynamic topological logics over spaces with continuous functions","2006","Advances in Modal Logic 2006","6","","","299","318","19","18","","https://www.scopus.com/inward/record.uri?eid=2-s2.0-37249051579&partnerID=40&md5=ec300cafd9f2aac183c96d2283c1deb1","Conference paper","Final","","Scopus","2-s2.0-37249051579"
"Van Benthem J.; Fernández-Duque D.; Pacuit E.","Van Benthem, Johan (7004928801); Fernández-Duque, David (50861124500); Pacuit, Eric (8928667300)","7004928801; 50861124500; 8928667300","Evidence logic: A new look at neighborhood structures","2014","Advances in Modal Logic","9","","","97","118","21","34","","https://www.scopus.com/inward/record.uri?eid=2-s2.0-84906734805&partnerID=40&md5=129fdf35bef57c641e96fcc893184bd6","Conference paper","Final","","Scopus","2-s2.0-84906734805"
"Kudinov A.","Kudinov, Andrey (55117642700)","55117642700","Topological modal logics with difference modality","2006","Advances in Modal Logic 2006","6","","","319","332","13","18","","https://www.scopus.com/inward/record.uri?eid=2-s2.0-34249314891&partnerID=40&md5=a27fb2f21ca2d6fe0a749b03d292e9bc","Conference paper","Final","","Scopus","2-s2.0-34249314891"
"Otto M.; Piro R.","Otto, Martin (57225398297); Piro, Robert (58833792400)","57225398297; 58833792400","A Lindström characterisation of the guarded fragment and of modal logic with a global modality","2008","Advances in Modal Logic 2006","7","","","273","287","14","14","","https://www.scopus.com/inward/record.uri?eid=2-s2.0-77955241246&partnerID=40&md5=87a7a6166896275088a60620f679cfbf","Conference paper","Final","","Scopus","2-s2.0-77955241246"
"Belkhir W.; Rossi G.; Rusinowitch M.","Belkhir, Walid (23466202000); Rossi, Gisela (56547949000); Rusinowitch, Michael (6701316794)","23466202000; 56547949000; 6701316794","A Parametrized propositional dynamic logic with application to service synthesis","2014","Advances in Modal Logic","10","","","34","53","19","2","","https://www.scopus.com/inward/record.uri?eid=2-s2.0-84924679882&partnerID=40&md5=d2cce402b9285c107e3fdcbbf3523dec","Conference paper","Final","","Scopus","2-s2.0-84924679882"
"Skvortsov D.","Skvortsov, Dmitrij (8571235100)","8571235100","A remark on propositional Kripke frames sound for intuitionistic logic","2010","Advances in Modal Logic 2006","8","","","392","410","18","0","","https://www.scopus.com/inward/record.uri?eid=2-s2.0-84858691306&partnerID=40&md5=24688de1d0aa7131b619cc971b482af1","Conference paper","Final","","Scopus","2-s2.0-84858691306"
"Wansing H.","Wansing, Heinrich (6602488540)","6602488540","Tableaux for multi-agent deliberative-stit logic","2006","Advances in Modal Logic 2006","6","","","503","520","17","20","","https://www.scopus.com/inward/record.uri?eid=2-s2.0-46349085372&partnerID=40&md5=280a5d8577959fff26c0e8baae6d6e37","Conference paper","Final","","Scopus","2-s2.0-46349085372"
"Kontchakov R.; Pratt-Hartmann I.; Wolter F.; Zakharyaschev M.","Kontchakov, Roman (23008721700); Pratt-Hartmann, Ian (7801463305); Wolter, Frank (7005739306); Zakharyaschev, Michael (6602982360)","23008721700; 7801463305; 7005739306; 6602982360","Topology, connectedness, and modal logic","2008","Advances in Modal Logic 2006","7","","","151","176","25","11","","https://www.scopus.com/inward/record.uri?eid=2-s2.0-84858633640&partnerID=40&md5=f599d94e14fd56a421ac93563dc6bf5e","Conference paper","Final","","Scopus","2-s2.0-84858633640"
"Schmidt R.A.","Schmidt, Renate A. (36020771500)","36020771500","Developing modal tableaux and resolution methods via first-order resolution","2006","Advances in Modal Logic 2006","6","","","1","26","25","11","","https://www.scopus.com/inward/record.uri?eid=2-s2.0-49949117418&partnerID=40&md5=42195323dc2dfed5f6f288072d8e73cf","Conference paper","Final","","Scopus","2-s2.0-49949117418"
"Kikot S.","Kikot, Stanislav (50262220100)","50262220100","Semantic characterization of Kracht formulas","2010","Advances in Modal Logic 2006","8","","","218","234","16","2","","https://www.scopus.com/inward/record.uri?eid=2-s2.0-84858650389&partnerID=40&md5=57a72e6e59f457575dcfdd169b49c6fb","Conference paper","Final","","Scopus","2-s2.0-84858650389"
"Sofronie-Stokkermans V.","Sofronie-Stokkermans, Viorica (6602903844)","6602903844","Locality and subsumption testing in ℰℒ and some of its extensions","2008","Advances in Modal Logic 2006","7","","","315","339","24","22","","https://www.scopus.com/inward/record.uri?eid=2-s2.0-84855194696&partnerID=40&md5=e24e7f00a1db6a8a1ac9630bd5257ed5","Conference paper","Final","","Scopus","2-s2.0-84855194696"
"Kurucz A.; Marcelino S.","Kurucz, Agi (8732161000); Marcelino, Sérgio (56584322100)","8732161000; 56584322100","Finite frames for K4.3 × S5 are decidable","2014","Advances in Modal Logic","9","","","411","436","25","0","","https://www.scopus.com/inward/record.uri?eid=2-s2.0-84906776011&partnerID=40&md5=119b972fc027cd244ccd15b9da759960","Conference paper","Final","","Scopus","2-s2.0-84906776011"
"French T.","French, Tim (13611425300)","13611425300","Bisimulation quantified modal logics: Decidability","2006","Advances in Modal Logic 2006","6","","","147","166","19","3","","https://www.scopus.com/inward/record.uri?eid=2-s2.0-38049078303&partnerID=40&md5=6557e738a3f15ac07a61733b7586a374","Conference paper","Final","","Scopus","2-s2.0-38049078303"
"Uckelman S.L.","Uckelman, Sara L. (18435222600)","18435222600","Three 13th-century views of quantified modal logic","2008","Advances in Modal Logic 2006","7","","","389","406","17","9","","https://www.scopus.com/inward/record.uri?eid=2-s2.0-77952213061&partnerID=40&md5=9c0cc51cbc54183879ce100127ab5c59","Conference paper","Final","","Scopus","2-s2.0-77952213061"
"Shapirovsky I.","Shapirovsky, Ilya (8716184900)","8716184900","Simulation of two dimensions in unimodal logics","2010","Advances in Modal Logic 2006","8","","","371","391","20","5","","https://www.scopus.com/inward/record.uri?eid=2-s2.0-84858660699&partnerID=40&md5=7dfc83ca9f7ba8c0ed033828b9d5d43d","Conference paper","Final","","Scopus","2-s2.0-84858660699"
"Konur S.","Konur, Savas (36174232900)","36174232900","An interval logic for natural language semantics","2008","Advances in Modal Logic 2006","7","","","177","191","14","9","","https://www.scopus.com/inward/record.uri?eid=2-s2.0-78650415486&partnerID=40&md5=0a5466823086acdba6dab24b25446334","Conference paper","Final","","Scopus","2-s2.0-78650415486"
"Chagrov A.; Chagrova L.","Chagrov, Alexander (16404927700); Chagrova, Lilia (16404533500)","16404927700; 16404533500","The truth about algorithmic problems in Correspondence Theory","2006","Advances in Modal Logic 2006","6","","","121","138","17","21","","https://www.scopus.com/inward/record.uri?eid=2-s2.0-77957374625&partnerID=40&md5=120c14550cf99a1365baaa60432102e6","Conference paper","Final","","Scopus","2-s2.0-77957374625"
"Kurucz A.; Wolter F.; Zakharyaschev M.","Kurucz, Agi (8732161000); Wolter, Frank (7005739306); Zakharyaschev, Michael (6602982360)","8732161000; 7005739306; 6602982360","Islands of tractability for relational constraints: Towards dichotomy results for the description logic ℰℒ","2010","Advances in Modal Logic 2006","8","","","271","291","20","8","","https://www.scopus.com/inward/record.uri?eid=2-s2.0-84858687475&partnerID=40&md5=9e85f49d4cf976192dbcf19483d83f7e","Conference paper","Final","","Scopus","2-s2.0-84858687475"
"Tinchev T.; Vakarelov D.","Tinchev, Tinko (6507090495); Vakarelov, Dimiter (6603656027)","6507090495; 6603656027","Logics of space with connectedness predicates: Complete axiomatizations","2010","Advances in Modal Logic 2006","8","","","434","453","19","8","","https://www.scopus.com/inward/record.uri?eid=2-s2.0-84858659460&partnerID=40&md5=f95ee2057c25eab6a0109be021e58a86","Conference paper","Final","","Scopus","2-s2.0-84858659460"
"Kudinov A.","Kudinov, Andrey (55117642700)","55117642700","Modal logic of some products of neighborhood frames","2014","Advances in Modal Logic","9","","","386","394","8","4","","https://www.scopus.com/inward/record.uri?eid=2-s2.0-84906763634&partnerID=40&md5=3315485639264aea4938d48c68622c10","Conference paper","Final","","Scopus","2-s2.0-84906763634"
"Tulenheimo T.","Tulenheimo, Tero (14042896500)","14042896500","Modal logic of time division","2008","Advances in Modal Logic 2006","7","","","363","387","24","1","","https://www.scopus.com/inward/record.uri?eid=2-s2.0-78951488483&partnerID=40&md5=1d77fe598a069cde5709d1b8541d816d","Conference paper","Final","","Scopus","2-s2.0-78951488483"
"Su C.-P.","Su, Che-Ping (56547862000)","56547862000","Paraconsistent justi-cation logic: A starting point","2014","Advances in Modal Logic","10","","","513","532","19","4","","https://www.scopus.com/inward/record.uri?eid=2-s2.0-84924650060&partnerID=40&md5=898a9a59b722429815215bb6d64997b3","Conference paper","Final","","Scopus","2-s2.0-84924650060"
"Goré R.; Postniece L.; Tiu A.","Goré, Rajeev (7102540943); Postniece, Linda (25121653100); Tiu, Alwen (8961912700)","7102540943; 25121653100; 8961912700","Cut-elimination and proof search for bi-intuitionistic tense logic","2010","Advances in Modal Logic 2006","8","","","156","177","21","19","","https://www.scopus.com/inward/record.uri?eid=2-s2.0-84858660452&partnerID=40&md5=bf04700ccf228c61b58fe1311fde7975","Conference paper","Final","","Scopus","2-s2.0-84858660452"
"Uckelman S.L.; Johnston S.","Uckelman, Sara L. (18435222600); Johnston, Spencer (59095635700)","18435222600; 59095635700","A simple semantics for Aristotelian apodeictic syllogistics","2010","Advances in Modal Logic 2006","8","","","454","469","15","6","","https://www.scopus.com/inward/record.uri?eid=2-s2.0-84858693226&partnerID=40&md5=59621c55e9810d08f803c9473a541963","Conference paper","Final","","Scopus","2-s2.0-84858693226"
"Gheerbrant A.","Gheerbrant, Amélie (27367875800)","27367875800","Complete axiomatization of the stutter-invariant fragment of the linear time μ-calculus","2010","Advances in Modal Logic 2006","8","","","140","155","15","0","","https://www.scopus.com/inward/record.uri?eid=2-s2.0-84858676506&partnerID=40&md5=52cb0ce548da357d7398f7f748f25349","Conference paper","Final","","Scopus","2-s2.0-84858676506"
"Gorin D.; Schroder L.","Gorin, Daniel (8889515700); Schroder, Lutz (7006618668)","8889515700; 7006618668","Subsumption checking in conjunctive coalgebraic fixpoint logics","2014","Advances in Modal Logic","10","","","254","273","19","1","","https://www.scopus.com/inward/record.uri?eid=2-s2.0-84924751007&partnerID=40&md5=3a245f4272a06a9570e093ef0561e936","Conference paper","Final","","Scopus","2-s2.0-84924751007"
"Gorín D.; Schröder L.","Gorín, Daniel (8889515700); Schröder, Lutz (7006618668)","8889515700; 7006618668","Extending ALCQ with bounded self-reference","2014","Advances in Modal Logic","9","","","300","316","16","2","","https://www.scopus.com/inward/record.uri?eid=2-s2.0-84906728949&partnerID=40&md5=5d2a776ff0ecf67219daa9ffad3cfb05","Conference paper","Final","","Scopus","2-s2.0-84906728949"
"Fernández-Duque D.","Fernández-Duque, David (50861124500)","50861124500","Absolute completeness of S4 u for its measure-theoretic semantics","2010","Advances in Modal Logic 2006","8","","","100","119","19","8","","https://www.scopus.com/inward/record.uri?eid=2-s2.0-84858657724&partnerID=40&md5=de9af0c82a35920765b10d9ff3352a41","Conference paper","Final","","Scopus","2-s2.0-84858657724"
"Balbiani P.; Kikot S.","Balbiani, Philippe (14625029700); Kikot, Stanislav (50262220100)","14625029700; 50262220100","Sahlqvist theorems for precontact logics","2014","Advances in Modal Logic","9","","","55","70","15","4","","https://www.scopus.com/inward/record.uri?eid=2-s2.0-84893808663&partnerID=40&md5=e999273de527728277ea68ee3972e68c","Conference paper","Final","","Scopus","2-s2.0-84893808663"
"Litak T.","Litak, Tadeusz (8865100500)","8865100500","Isomorphism via translation","2006","Advances in Modal Logic 2006","6","","","333","351","18","7","","https://www.scopus.com/inward/record.uri?eid=2-s2.0-34249312418&partnerID=40&md5=3a1f894a7c8fb9704a32f5843b7254cb","Conference paper","Final","","Scopus","2-s2.0-34249312418"
"Takamura H.","Takamura, Hiroki (36992538900)","36992538900","The variety of modal FL ew-algebras is generated by its finite simple members","2006","Advances in Modal Logic 2006","6","","","469","479","10","1","","https://www.scopus.com/inward/record.uri?eid=2-s2.0-40649101791&partnerID=40&md5=ecdee0dde127aa51913f27a65f5c203f","Conference paper","Final","","Scopus","2-s2.0-40649101791"
"Wansing H.","Wansing, Heinrich (6602488540)","6602488540","Proofs, disproofs, and their duals","2010","Advances in Modal Logic 2006","8","","","483","505","22","34","","https://www.scopus.com/inward/record.uri?eid=2-s2.0-82455209825&partnerID=40&md5=d87dbf8279f3e2fb090104b4b9834a0f","Conference paper","Final","","Scopus","2-s2.0-82455209825"
"Fontaine G.","Fontaine, Gaëlle (36022525700)","36022525700","ML is not finitely axiomatizable over Cheq","2006","Advances in Modal Logic 2006","6","","","139","146","7","1","","https://www.scopus.com/inward/record.uri?eid=2-s2.0-84858663313&partnerID=40&md5=26e41256da98fd9bb367484a5dfbc1b8","Conference paper","Final","","Scopus","2-s2.0-84858663313"
"Suzuki T.","Suzuki, Tomoyuki (55731644000)","55731644000","Morphisms on Bi-approximation semantics","2014","Advances in Modal Logic","9","","","494","515","21","4","","https://www.scopus.com/inward/record.uri?eid=2-s2.0-84906761261&partnerID=40&md5=50010155e943fde3615e1bfe36e8597c","Conference paper","Final","","Scopus","2-s2.0-84906761261"
"","","","Advances in Modal Logic 2006","2006","Advances in Modal Logic 2006","6","","","","","520","0","","https://www.scopus.com/inward/record.uri?eid=2-s2.0-84858671505&partnerID=40&md5=7f50c074e4ed33bbb1a3d12f15df2ef8","Conference review","Final","","Scopus","2-s2.0-84858671505"
"Balbiani P.; Shapirovsky I.; Shehtman V.","Balbiani, P. (14625029700); Shapirovsky, I. (8716184900); Shehtman, V. (16470280300)","14625029700; 8716184900; 16470280300","Every world can see a Sahlqvist world","2006","Advances in Modal Logic 2006","6","","","69","85","16","7","","https://www.scopus.com/inward/record.uri?eid=2-s2.0-78049354664&partnerID=40&md5=66413e1dccadbc8e8d637fa17c266256","Conference paper","Final","","Scopus","2-s2.0-78049354664"
"Rybakov M.","Rybakov, Mikhail (55114172200)","55114172200","Complexity of intuitionistic and Visser's basic and formal logics in finitely many variables","2006","Advances in Modal Logic 2006","6","","","393","411","18","21","","https://www.scopus.com/inward/record.uri?eid=2-s2.0-78049290234&partnerID=40&md5=9b35b1b828f9bde6bd1810b607f2eb5b","Conference paper","Final","","Scopus","2-s2.0-78049290234"
"Kupke C.; Kurz A.; Venema Y.","Kupke, Clemens (6602390943); Kurz, Alexander (35817688100); Venema, Yde (6603586695)","6602390943; 35817688100; 6603586695","Completeness of the finitary Moss logic","2008","Advances in Modal Logic 2006","7","","","193","217","24","20","","https://www.scopus.com/inward/record.uri?eid=2-s2.0-68549089764&partnerID=40&md5=1407af17bbd37ee911ee99e53f064f4f","Conference paper","Final","","Scopus","2-s2.0-68549089764"
"Kurucz A.","Kurucz, Agi (8732161000)","8732161000","On the complexity of modal axiomatisations over many-dimensional structures","2010","Advances in Modal Logic 2006","8","","","256","270","14","8","","https://www.scopus.com/inward/record.uri?eid=2-s2.0-84858679507&partnerID=40&md5=f462bf6245296c9ae0d9838f3094d85b","Conference paper","Final","","Scopus","2-s2.0-84858679507"
"Suzuki T.","Suzuki, Tomoyuki (55731644000)","55731644000","Bi-approximation semantics for substructural logic at work","2010","Advances in Modal Logic 2006","8","","","411","433","22","13","","https://www.scopus.com/inward/record.uri?eid=2-s2.0-84863354800&partnerID=40&md5=eb02fad7072a1e9f33f575cfe9a7f37c","Conference paper","Final","","Scopus","2-s2.0-84863354800"
"Shehtman V.","Shehtman, Valentin (16470280300)","16470280300","Completeness and incompleteness in first-order modal logic: An overview","2006","Advances in Modal Logic 2006","6","","","27","30","3","1","","https://www.scopus.com/inward/record.uri?eid=2-s2.0-64549157683&partnerID=40&md5=af4f297335679611c93db5caa6becbff","Conference paper","Final","","Scopus","2-s2.0-64549157683"
"","","","Advances in Modal Logic 2010","2010","Advances in Modal Logic 2006","8","","","","","505","0","","https://www.scopus.com/inward/record.uri?eid=2-s2.0-84858626143&partnerID=40&md5=09ac74ba67ebd49ee2bfecd77c7e7f79","Conference review","Final","","Scopus","2-s2.0-84858626143"
"Sano K.; Ma M.","Sano, Katsuhiko (26536684100); Ma, Minghui (36084867200)","26536684100; 36084867200","Goldblatt-Thomason-style Theorems for graded modal language","2010","Advances in Modal Logic 2006","8","","","330","349","19","12","","https://www.scopus.com/inward/record.uri?eid=2-s2.0-84858648271&partnerID=40&md5=57288e8db152d0fd87130978ecd21fe7","Conference paper","Final","","Scopus","2-s2.0-84858648271"
"Tanabe Y.; Takahashi K.; Hagiya M.","Tanabe, Yoshinori (23010649800); Takahashi, Koichi (55741264800); Hagiya, Masami (7006475909)","23010649800; 55741264800; 7006475909","A decision procedure for alternation-free modal μ-calculi","2008","Advances in Modal Logic 2006","7","","","341","362","21","14","","https://www.scopus.com/inward/record.uri?eid=2-s2.0-84863338294&partnerID=40&md5=10b0ecc1ab721e053317fa55afd5a98b","Conference paper","Final","","Scopus","2-s2.0-84863338294"
"Nenov Y.; Vakarelov D.","Nenov, Yavor (36473927400); Vakarelov, Dimiter (6603656027)","36473927400; 6603656027","Modal logics for mereotopological relations","2008","Advances in Modal Logic 2006","7","","","249","272","23","8","","https://www.scopus.com/inward/record.uri?eid=2-s2.0-80053129563&partnerID=40&md5=1ba021f7311f8f25f0ccb78fdfad70e4","Conference paper","Final","","Scopus","2-s2.0-80053129563"
"Balbiani P.","Balbiani, Philippe (14625029700)","14625029700","An expressive two-sorted spatial logic for plane projective geometry","2006","Advances in Modal Logic 2006","6","","","49","68","19","1","","https://www.scopus.com/inward/record.uri?eid=2-s2.0-70350202649&partnerID=40&md5=1dfce4066f8b60493edf3ead1a291f45","Conference paper","Final","","Scopus","2-s2.0-70350202649"
"Bílková M.; Palmigiano A.; Venema Y.","Bílková, Marta (56109602900); Palmigiano, Alessandra (6505874546); Venema, Yde (6603586695)","56109602900; 6505874546; 6603586695","Proof systems for the coalgebraic cover modality","2008","Advances in Modal Logic 2006","7","","","1","21","20","24","","https://www.scopus.com/inward/record.uri?eid=2-s2.0-77956784718&partnerID=40&md5=806f9596a156aa08a4b5283dbb2af2c1","Conference paper","Final","","Scopus","2-s2.0-77956784718"
