"Authors","Author full names","Author(s) ID","Title","Year","Source title","Volume","Issue","Art. No.","Page start","Page end","Page count","Cited by","DOI","Link","Document Type","Publication Stage","Open Access","Source","EID"
"Pacuit E.","Pacuit, Eric (8928667300)","8928667300","Varieties of strategic reasoning in games","2014","CEUR Workshop Proceedings","1208","","","26","30","4","0","","https://www.scopus.com/inward/record.uri?eid=2-s2.0-84922032234&partnerID=40&md5=b09feae6819e3a2777021117b7dbf3bf","Conference paper","Final","","Scopus","2-s2.0-84922032234"
"Reynolds M.","Reynolds, Mark (24792488500)","24792488500","A tableau for temporal logic over the reals","2014","Advances in Modal Logic","10","","","439","458","19","4","","https://www.scopus.com/inward/record.uri?eid=2-s2.0-84924698802&partnerID=40&md5=464977b1aabd4e6176e96946c0751ea8","Conference paper","Final","","Scopus","2-s2.0-84924698802"
"Hella L.; Kuusisto A.","Hella, Lauri (6603815639); Kuusisto, Antti (48861264200)","6603815639; 48861264200","One-dimensional fragment of first-order logic","2014","Advances in Modal Logic","10","","","274","293","19","19","","https://www.scopus.com/inward/record.uri?eid=2-s2.0-84924750590&partnerID=40&md5=311b3d1b27456622f166c35a2dbbb7bf","Conference paper","Final","","Scopus","2-s2.0-84924750590"
"Citkin A.","Citkin, Alex (53163374300)","53163374300","One-generated WS5-algebras","2018","Advances in Modal Logic","12","","","143","158","15","0","","https://www.scopus.com/inward/record.uri?eid=2-s2.0-85076461637&partnerID=40&md5=b6922fe27f8bc21660481e74691fc6a1","Conference paper","Final","","Scopus","2-s2.0-85076461637"
"Kikot S.; Kurucz A.; Wolter F.; Zakharyaschev M.","Kikot, Stanislav (50262220100); Kurucz, Agi (8732161000); Wolter, Frank (7005739306); Zakharyaschev, Michael (6602982360)","50262220100; 8732161000; 7005739306; 6602982360","On strictly positive modal logics with S4.3 frames","2018","Advances in Modal Logic","12","","","427","446","19","1","","https://www.scopus.com/inward/record.uri?eid=2-s2.0-85067110218&partnerID=40&md5=846b8bb538d997e49c81b594cf6e9caa","Conference paper","Final","","Scopus","2-s2.0-85067110218"
"French T.; Hales J.; Tay E.","French, Tim (13611425300); Hales, James (53984444200); Tay, Edwin (57217473702)","13611425300; 53984444200; 57217473702","A composable language for action models","2014","Advances in Modal Logic","10","","","197","216","19","11","","https://www.scopus.com/inward/record.uri?eid=2-s2.0-84924724485&partnerID=40&md5=3904be900ac64833f9d891ffa00a6403","Conference paper","Final","","Scopus","2-s2.0-84924724485"
"Suzuki T.","Suzuki, Tomoyuki (59870739500)","59870739500","On polarity frames: Applications to substructural and lattice-based logics","2014","Advances in Modal Logic","10","","","533","552","19","4","","https://www.scopus.com/inward/record.uri?eid=2-s2.0-84924751201&partnerID=40&md5=593ed7b171df2e83fab5c3e3dd135b80","Conference paper","Final","","Scopus","2-s2.0-84924751201"
"Balbiani P.; Fernández-Duque D.","Balbiani, Philippe (14625029700); Fernández-Duque, David (50861124500)","14625029700; 50861124500","Axiomatizing the lexicographic products of modal logics with linear temporal logic","2016","Advances in Modal Logic","11","","","78","96","18","5","","https://www.scopus.com/inward/record.uri?eid=2-s2.0-85019458358&partnerID=40&md5=e4b7fdae0ba2ae8a014cd841cbe7e061","Conference paper","Final","","Scopus","2-s2.0-85019458358"
"","","","9th Conference on Advances in Modal Logic, AiML 2012","2014","Advances in Modal Logic","9","","","","","580","0","","https://www.scopus.com/inward/record.uri?eid=2-s2.0-84906818928&partnerID=40&md5=253daa68028b099e2232566fa4bcd885","Conference review","Final","","Scopus","2-s2.0-84906818928"
"Nauerz C.","Nauerz, Christian (56500712600)","56500712600","Understanding reasoning using utility proportional beliefs","2014","CEUR Workshop Proceedings","1208","","","21","25","4","0","","https://www.scopus.com/inward/record.uri?eid=2-s2.0-84922024059&partnerID=40&md5=e8844376dddb75b7a43a27d6318c43a7","Conference paper","Final","","Scopus","2-s2.0-84922024059"
"Van Ditmarsch H.; Van Der Hoek W.; Kuijer L.B.","Van Ditmarsch, Hans (57215882990); Van Der Hoek, Wiebe (7005925719); Kuijer, Louwe B. (55332414000)","57215882990; 7005925719; 55332414000","Fully Arbitrary Public Announcements","2016","Advances in Modal Logic","11","","","252","267","15","6","","https://www.scopus.com/inward/record.uri?eid=2-s2.0-85019479398&partnerID=40&md5=061af495af7b0f36d93bf63aa105622c","Conference paper","Final","","Scopus","2-s2.0-85019479398"
"","","","Advances in Modal Logic","2014","Advances in Modal Logic","10","","","588p","","","0","","https://www.scopus.com/inward/record.uri?eid=2-s2.0-84925243110&partnerID=40&md5=22b01e4108233436f397d8197d556ed3","Conference review","Final","","Scopus","2-s2.0-84925243110"
"Szymanik J.; Verbrugge R.","Szymanik, Jakub (16246437200); Verbrugge, Rineke (6701472768)","16246437200; 6701472768","Preface : The workshop theme","2014","CEUR Workshop Proceedings","1208","","","","","","0","","https://www.scopus.com/inward/record.uri?eid=2-s2.0-84922032192&partnerID=40&md5=324309cee3587d185e2bbe8d01b0bb63","Editorial","Final","","Scopus","2-s2.0-84922032192"
"De Almeida Borges A.; Joosten J.J.","De Almeida Borges, Ana (57211338991); Joosten, Joost J. (8719453500)","57211338991; 8719453500","The worm calculus","2018","Advances in Modal Logic","12","","","13","27","14","2","","https://www.scopus.com/inward/record.uri?eid=2-s2.0-85068612899&partnerID=40&md5=0393378965ee81bdf8968b7a78078bc6","Conference paper","Final","","Scopus","2-s2.0-85068612899"
"Shehtman V.","Shehtman, Valentin (16470280300)","16470280300","Canonical filtrations and local tabularity","2014","Advances in Modal Logic","10","","","498","512","14","6","","https://www.scopus.com/inward/record.uri?eid=2-s2.0-84924670373&partnerID=40&md5=a7f9b5728ba0d448e2d6c03731674b6e","Conference paper","Final","","Scopus","2-s2.0-84924670373"
"Balbiani P.; Fernández-Duque D.; Herzig A.; Iliev P.","Balbiani, Philippe (14625029700); Fernández-Duque, David (50861124500); Herzig, Andreas (7004448048); Iliev, Petar (24481404700)","14625029700; 50861124500; 7004448048; 24481404700","Frame-validity games and absolute minimality of modal axioms","2018","Advances in Modal Logic","12","","","83","102","19","2","","https://www.scopus.com/inward/record.uri?eid=2-s2.0-85076475030&partnerID=40&md5=305b3c1bca06b89fefde97c2a861bfb9","Conference paper","Final","","Scopus","2-s2.0-85076475030"
"Forster J.; Schr L.","Forster, Jonas (57219754857); Schr, Lutzöder (57872091800)","57219754857; 57872091800","Non-iterative Modal Logics are Coalgebraic","2020","Advances in Modal Logic","13","","","229","248","19","0","","https://www.scopus.com/inward/record.uri?eid=2-s2.0-85137155591&partnerID=40&md5=c0603cea36cd8bdd232ac845bd3a13e5","Conference paper","Final","","Scopus","2-s2.0-85137155591"
"Cintula P.; Metcalfe G.; Tokuda N.","Cintula, Petr (6602206743); Metcalfe, George (16316754700); Tokuda, Naomi (57225178544)","6602206743; 16316754700; 57225178544","Algebraic Semantics for One-Variable Lattice-Valued Logics","2022","Advances in Modal Logic","14","","","237","257","20","1","","https://www.scopus.com/inward/record.uri?eid=2-s2.0-85175599977&partnerID=40&md5=972bdd4031dae2a8e1f2a3c6e9275fb4","Conference paper","Final","","Scopus","2-s2.0-85175599977"
"Wang Y.; Seligman J.","Wang, Yanjing (23468057900); Seligman, Jeremy (7003486190)","23468057900; 7003486190","When names are not commonly known: Epistemic logic with assignments","2018","Advances in Modal Logic","12","","","611","628","17","12","","https://www.scopus.com/inward/record.uri?eid=2-s2.0-85063490711&partnerID=40&md5=d8b5f92863b727eefbdd93ca57aacae2","Conference paper","Final","","Scopus","2-s2.0-85063490711"
"Goranko V.","Goranko, Valentin (6507595680)","6507595680","The modal logic of almost sure frame validities in the finite","2020","Advances in Modal Logic","13","","","249","268","19","2","","https://www.scopus.com/inward/record.uri?eid=2-s2.0-85108719788&partnerID=40&md5=37746c2df595999bdc1d9acbd1a34b7f","Conference paper","Final","","Scopus","2-s2.0-85108719788"
"Sedlár I.","Sedlár, Igor (26035855600)","26035855600","Finitely-valued Propositional Dynamic Logic","2020","Advances in Modal Logic","13","","","561","579","18","4","","https://www.scopus.com/inward/record.uri?eid=2-s2.0-85100284039&partnerID=40&md5=434f4e09b7d535af1d5dc5fdfe0fae4f","Conference paper","Final","","Scopus","2-s2.0-85100284039"
"Herzig A.; Perrotin E.","Herzig, Andreas (7004448048); Perrotin, Elise (57212010172)","7004448048; 57212010172","On the axiomatisation of common knowledge","2020","Advances in Modal Logic","13","","","309","328","19","5","","https://www.scopus.com/inward/record.uri?eid=2-s2.0-85112227821&partnerID=40&md5=4682d444935c35d82e8017245c7bde7f","Conference paper","Final","","Scopus","2-s2.0-85112227821"
"Kikot S.; Shapirovsky I.; Zolin E.","Kikot, Stanislav (50262220100); Shapirovsky, Ilya (8716184900); Zolin, Evgeny (23399170500)","50262220100; 8716184900; 23399170500","Modal Logics with Transitive Closure: Completeness, Decidability, Filtration","2020","Advances in Modal Logic","13","","","369","388","19","6","","https://www.scopus.com/inward/record.uri?eid=2-s2.0-85115824360&partnerID=40&md5=d7f8b6618787899fd7400c7bdfbba520","Conference paper","Final","","Scopus","2-s2.0-85115824360"
"Rybakov M.; Shkatov D.","Rybakov, Mikhail (55114172200); Shkatov, Dmitry (14058982200)","55114172200; 14058982200","A recursively enumerable Kripke complete first-order logic not complete with respect to a first-order definable class of frames","2018","Advances in Modal Logic","12","","","531","539","8","14","","https://www.scopus.com/inward/record.uri?eid=2-s2.0-85076499510&partnerID=40&md5=684ef43466e0397c4e6366baca8bae48","Conference paper","Final","","Scopus","2-s2.0-85076499510"
"Ciardelli I.","Ciardelli, Ivano (35112991100)","35112991100","Dependence statements are strict conditionals","2018","Advances in Modal Logic","12","","","123","142","19","9","","https://www.scopus.com/inward/record.uri?eid=2-s2.0-85076491111&partnerID=40&md5=3290e00bef8850d01d3d8feafbae22b6","Conference paper","Final","","Scopus","2-s2.0-85076491111"
"Olivetti N.; Verbrugge R.; Negri S.; Sandu G.","Olivetti, Nicola (6602658033); Verbrugge, Rineke (6701472768); Negri, Sara (36907914500); Sandu, Gabriel (16408905600)","6602658033; 6701472768; 36907914500; 16408905600","Preface","2020","Advances in Modal Logic","13","","","VIII","XI","","0","","https://www.scopus.com/inward/record.uri?eid=2-s2.0-85137292830&partnerID=40&md5=199d2f51102878affd96e3cef3d28c13","Editorial","Final","","Scopus","2-s2.0-85137292830"
"de Groot J.","de Groot, Jim (57209744757)","57209744757","Goldblatt-Thomason Theorems for Modal Intuitionistic Logics","2022","Advances in Modal Logic","14","","","467","489","22","0","","https://www.scopus.com/inward/record.uri?eid=2-s2.0-85184350010&partnerID=40&md5=1d6499bed2244aff4a1cfda9fe5e1133","Conference paper","Final","","Scopus","2-s2.0-85184350010"
"van Benthem J.; ten Cate B.; Koudijs R.","van Benthem, Johan (7004928801); ten Cate, Balder (8964763900); Koudijs, Raoul (57226186763)","7004928801; 8964763900; 57226186763","Local Dependence and Guarding","2022","Advances in Modal Logic","14","","","135","154","19","0","","https://www.scopus.com/inward/record.uri?eid=2-s2.0-85184347740&partnerID=40&md5=3eeb10c64b39e2fa55b4ef86c30f9750","Conference paper","Final","","Scopus","2-s2.0-85184347740"
"Bezhanishvili N.; Ghilardi S.; Landi L.","Bezhanishvili, Nick (6507589688); Ghilardi, Silvio (6602896116); Landi, Lucia (57425512300)","6507589688; 6602896116; 57425512300","Model Completeness and Π2-rules: The case of Contact Algebras","2020","Advances in Modal Logic","13","","","115","132","17","3","","https://www.scopus.com/inward/record.uri?eid=2-s2.0-85118079998&partnerID=40&md5=601022734a95948660cc65335208beeb","Conference paper","Final","","Scopus","2-s2.0-85118079998"
"Bledin J.; Melamed Y.","Bledin, Justin (6504776584); Melamed, Yitzhak (27467538700)","6504776584; 27467538700","Spinozian Model Theory","2020","Advances in Modal Logic","13","","","133","147","14","1","","https://www.scopus.com/inward/record.uri?eid=2-s2.0-85137161500&partnerID=40&md5=8fdb1445b429fd6cd927bafd19889365","Conference paper","Final","","Scopus","2-s2.0-85137161500"
"Indrzejczak A.","Indrzejczak, Andrzej (47961993600)","47961993600","Existence, Definedness and Definite Descriptions in Hybrid Modal Logic","2020","Advances in Modal Logic","13","","","349","368","19","20","","https://www.scopus.com/inward/record.uri?eid=2-s2.0-85099483741&partnerID=40&md5=fef9d50c9d02749b44bf55f0ab586383","Conference paper","Final","","Scopus","2-s2.0-85099483741"
"Gierasimczuk N.","Gierasimczuk, Nina (23392666500)","23392666500","Learning and Modal Logic: There and Back Again","2020","Advances in Modal Logic","13","","","9","10","1","0","","https://www.scopus.com/inward/record.uri?eid=2-s2.0-85137284259&partnerID=40&md5=be6cad1a37559f008f48dd983b5f38e8","Conference paper","Final","","Scopus","2-s2.0-85137284259"
"Bezhanishvili N.","Bezhanishvili, Nick (6507589688)","6507589688","Filtrations, canonical formulas, and axiomatizations of superintuitionistic and modal logics","2020","Advances in Modal Logic","13","","","5","","","0","","https://www.scopus.com/inward/record.uri?eid=2-s2.0-85137300783&partnerID=40&md5=36293e4b3943f48dcd93fddc99a5dd23","Conference paper","Final","","Scopus","2-s2.0-85137300783"
"Panettiere M.; Tzimoulis A.","Panettiere, Mattia (57220764529); Tzimoulis, Apostolos (57015299400)","57220764529; 57015299400","Graded modal logic with a single modality","2022","Advances in Modal Logic","14","","","643","657","14","1","","https://www.scopus.com/inward/record.uri?eid=2-s2.0-85183327643&partnerID=40&md5=1d8e5b53b63200735ce8a432557184ec","Conference paper","Final","","Scopus","2-s2.0-85183327643"
"","","","Advances in Modal Logic","2022","Advances in Modal Logic","14","","","","","747","0","","https://www.scopus.com/inward/record.uri?eid=2-s2.0-85184962840&partnerID=40&md5=3f141d8085ff0396144944c945c08860","Conference review","Final","","Scopus","2-s2.0-85184962840"
"Holliday W.H.; Litak T.","Holliday, Wesley H. (36704582700); Litak, Tadeusz (8865100500)","36704582700; 8865100500","One modal logic to rule them all?","2018","Advances in Modal Logic","12","","","367","386","19","7","","https://www.scopus.com/inward/record.uri?eid=2-s2.0-85071714457&partnerID=40&md5=6ee3589b4f8c92ab8e2ba47cd30b1bc0","Conference paper","Final","","Scopus","2-s2.0-85071714457"
"Dalmonte T.; Olivetti N.; Negri S.","Dalmonte, Tiziano (57209283144); Olivetti, Nicola (6602658033); Negri, Sara (36907914500)","57209283144; 6602658033; 36907914500","Non-normal modal logics: Bi-neighbourhood semantics and its labelled calculi","2018","Advances in Modal Logic","12","","","159","178","19","21","","https://www.scopus.com/inward/record.uri?eid=2-s2.0-85067195802&partnerID=40&md5=a0ca62340a56a17187ce6d2c38b26666","Conference paper","Final","","Scopus","2-s2.0-85067195802"
"Kikot S.","Kikot, Stanislav (50262220100)","50262220100","Kripke completeness of strictly positive modal logics over meet semi-lattices with operators","2018","Advances in Modal Logic","12","","","29","42","13","0","","https://www.scopus.com/inward/record.uri?eid=2-s2.0-85076459741&partnerID=40&md5=fe846a24eb5015e29d3ff2e65a4af879","Conference paper","Final","","Scopus","2-s2.0-85076459741"
"Kuznetsov S.","Kuznetsov, Stepan (54914981600)","54914981600","∗-continuity vs. induction: Divide and conquer","2018","Advances in Modal Logic","12","","","493","510","17","11","","https://www.scopus.com/inward/record.uri?eid=2-s2.0-85070768361&partnerID=40&md5=969c2fafb77d94069ef55be81016d95d","Conference paper","Final","","Scopus","2-s2.0-85070768361"
"Niki S.","Niki, Satoru (57211685972)","57211685972","Intuitionistic Modality and Beth Semantics","2022","Advances in Modal Logic","14","","","579","599","20","0","","https://www.scopus.com/inward/record.uri?eid=2-s2.0-85184345953&partnerID=40&md5=6d68737fdc18f007d310bffe3f031245","Conference paper","Final","","Scopus","2-s2.0-85184345953"
"Balbiani P.; Diéguez M.","Balbiani, Philippe (14625029700); Diéguez, Martin (37121775200)","14625029700; 37121775200","Here and there modal logic with dual implication","2018","Advances in Modal Logic","12","","","63","82","19","2","","https://www.scopus.com/inward/record.uri?eid=2-s2.0-85076459340&partnerID=40&md5=0bb9925be3973f36a39bb7a92d310fe0","Conference paper","Final","","Scopus","2-s2.0-85076459340"
"Fernández-Duque D.; Palmigiano A.; Pinchinat S.","Fernández-Duque, David (50861124500); Palmigiano, Alessandra (6505874546); Pinchinat, Sophie (8661235300)","50861124500; 6505874546; 8661235300","Preface","2022","Advances in Modal Logic","14","","","IX","XII","","0","","https://www.scopus.com/inward/record.uri?eid=2-s2.0-85184959834&partnerID=40&md5=baa146d8f9713932ea3081a957aa87ab","Editorial","Final","","Scopus","2-s2.0-85184959834"
"Conradie W.; Panettiere M.","Conradie, Willem (55584792103); Panettiere, Mattia (57220764529)","55584792103; 57220764529","Modal inverse correspondence via ALBA","2022","Advances in Modal Logic","14","","","259","281","22","0","","https://www.scopus.com/inward/record.uri?eid=2-s2.0-85127050463&partnerID=40&md5=52045880eaed5953132bef2ad7e68d6e","Conference paper","Final","","Scopus","2-s2.0-85127050463"
"De Almeida Borges A.; Joosten J.J.","De Almeida Borges, Ana (57211338991); Joosten, Joost J. (8719453500)","57211338991; 8719453500","Quantified Re ection Calculus with one modality","2020","Advances in Modal Logic","13","","","13","32","19","3","","https://www.scopus.com/inward/record.uri?eid=2-s2.0-85117442959&partnerID=40&md5=8497ce16ffa6756787892217caa8a27c","Conference paper","Final","","Scopus","2-s2.0-85117442959"
"Rooduijn J.; Zenger L.","Rooduijn, Jan (57264336500); Zenger, Lukas (58620718600)","57264336500; 58620718600","An analytic proof system for common knowledge logic over S5","2022","Advances in Modal Logic","14","","","659","679","20","4","","https://www.scopus.com/inward/record.uri?eid=2-s2.0-85165594349&partnerID=40&md5=e7fb070387cd979bf50015952f0be79b","Conference paper","Final","","Scopus","2-s2.0-85165594349"
"Kowalski T.; Metcalfe G.","Kowalski, Tomasz (27667672300); Metcalfe, George (16316754700)","27667672300; 16316754700","Coherence in modal logic","2018","Advances in Modal Logic","12","","","459","472","13","0","","https://www.scopus.com/inward/record.uri?eid=2-s2.0-85076498492&partnerID=40&md5=c0014f5a03287cb8b8ad54299d94a894","Conference paper","Final","","Scopus","2-s2.0-85076498492"
"Fitting M.","Fitting, Melvin (7004902534)","7004902534","About 'Binding Modalities'","2020","Advances in Modal Logic","13","","","7","","","0","","https://www.scopus.com/inward/record.uri?eid=2-s2.0-85137301840&partnerID=40&md5=0068dfe8fc9cc8d87c28de81b1dad624","Conference paper","Final","","Scopus","2-s2.0-85137301840"
"Shehtman V.","Shehtman, Valentin (16470280300)","16470280300","On Kripke completeness of some modal predicate logics with the density axiom","2018","Advances in Modal Logic","12","","","559","575","16","1","","https://www.scopus.com/inward/record.uri?eid=2-s2.0-85076483795&partnerID=40&md5=d3a533f4541dedc713f8bd9e900552d0","Conference paper","Final","","Scopus","2-s2.0-85076483795"
"Uckelman S.L.","Uckelman, Sara L. (18435222600)","18435222600","William of Sherwood on Necessity and Contingency","2020","Advances in Modal Logic","13","","","597","612","15","0","","https://www.scopus.com/inward/record.uri?eid=2-s2.0-85137165458&partnerID=40&md5=8b376b88f891df24208baffdb7784092","Conference paper","Final","","Scopus","2-s2.0-85137165458"
"Balbiani P.; Van Ditmarsch H.; González S.F.","Balbiani, Philippe (14625029700); Van Ditmarsch, Hans (57215882990); González, Saúl Fernández (57458371100)","14625029700; 57215882990; 57458371100","Quantifying over Asynchronous Information Change","2020","Advances in Modal Logic","13","","","33","52","19","2","","https://www.scopus.com/inward/record.uri?eid=2-s2.0-85137152702&partnerID=40&md5=3b791f84b51a25e9b0a29802d53ec2c2","Conference paper","Final","","Scopus","2-s2.0-85137152702"
"Dalmonte T.","Dalmonte, Tiziano (57209283144)","57209283144","Wijesekera-style constructive modal logics","2022","Advances in Modal Logic","14","","","281","303","22","3","","https://www.scopus.com/inward/record.uri?eid=2-s2.0-85172421011&partnerID=40&md5=0c6c05efdce48dad4f33bf08b669c93e","Conference paper","Final","","Scopus","2-s2.0-85172421011"
"Ono H.; Sano K.","Ono, Hiroakira (14043972700); Sano, Katsuhiko (26536684100)","14043972700; 26536684100","Analytic Cut and Mints’ Symmetric Interpolation Method for Bi-intuitionistic Tense Logic","2022","Advances in Modal Logic","14","","","601","623","22","3","","https://www.scopus.com/inward/record.uri?eid=2-s2.0-85160691033&partnerID=40&md5=f47e79f26f9b6caa7409aeb7101345bc","Conference paper","Final","","Scopus","2-s2.0-85160691033"
"Enqvist S.","Enqvist, Sebastian (35388014000)","35388014000","A circular proof system for the hybrid μ-calculus","2020","Advances in Modal Logic","13","","","169","188","19","1","","https://www.scopus.com/inward/record.uri?eid=2-s2.0-85137156611&partnerID=40&md5=fef14d6c798b02f1f70b8568536d9037","Conference paper","Final","","Scopus","2-s2.0-85137156611"
"","","","Advances in Modal Logic, AiML 2020","2020","Advances in Modal Logic","13","","","","","612","0","","https://www.scopus.com/inward/record.uri?eid=2-s2.0-85137290310&partnerID=40&md5=2046ef7e5737fe530915a0a5cc750f1b","Conference review","Final","","Scopus","2-s2.0-85137290310"
"Tabatabai A.A.","Tabatabai, Amirhossein Akbar (57219462323)","57219462323","Provability Logics of Hierarchies","2022","Advances in Modal Logic","14","","","59","76","17","0","","https://www.scopus.com/inward/record.uri?eid=2-s2.0-85184354434&partnerID=40&md5=fa637b7a28e3b966e37ddc5aed2dbd7b","Conference paper","Final","","Scopus","2-s2.0-85184354434"
"Sano K.","Sano, Katsuhiko (26536684100)","26536684100","Goldblatt-Thomason-style Characterization for Intuitionistic Inquisitive Logic","2020","Advances in Modal Logic","13","","","541","560","19","1","","https://www.scopus.com/inward/record.uri?eid=2-s2.0-85137155006&partnerID=40&md5=b5a48eefec8b8448c3793994b6476865","Conference paper","Final","","Scopus","2-s2.0-85137155006"
"Douéneau-Tabot G.; Pinchinat S.; Schwarzentruber F.","Douéneau-Tabot, Gaëtan (57202919862); Pinchinat, Sophie (8661235300); Schwarzentruber, François (36705319600)","57202919862; 8661235300; 36705319600","Chain-monadic second order logic over regular automatic trees and epistemic planning synthesis","2018","Advances in Modal Logic","12","","","237","256","19","5","","https://www.scopus.com/inward/record.uri?eid=2-s2.0-85074947520&partnerID=40&md5=31f5c4df3cab6b3a712997ea44ef5f30","Conference paper","Final","","Scopus","2-s2.0-85074947520"
"Fröhlich N.; Meier A.","Fröhlich, Nicolas (59176742300); Meier, Arne (25927331400)","59176742300; 25927331400","Submodel Enumeration of Kripke Structures in Modal Logic","2022","Advances in Modal Logic","14","","","391","406","15","1","","https://www.scopus.com/inward/record.uri?eid=2-s2.0-85180562844&partnerID=40&md5=a2214f0222e2d8288e0ae5fbc4857815","Conference paper","Final","","Scopus","2-s2.0-85180562844"
"Koussas J.; Kowalski T.; Miyazaki Y.; Stevens M.","Koussas, James (57212343129); Kowalski, Tomasz (27667672300); Miyazaki, Yutaka (36991261600); Stevens, Michael (57212340201)","57212343129; 27667672300; 36991261600; 57212340201","Normal extensions of KTB of codimension 3","2018","Advances in Modal Logic","12","","","447","458","11","0","","https://www.scopus.com/inward/record.uri?eid=2-s2.0-85076461553&partnerID=40&md5=a6c692b85500832376edb9beee18effd","Conference paper","Final","","Scopus","2-s2.0-85076461553"
"Ju F.; Grilletti G.; Goranko V.","Ju, Fengkui (53363782100); Grilletti, Gianluca (57090757000); Goranko, Valentin (6507595680)","53363782100; 57090757000; 6507595680","A logic for temporal conditionals and a solution to the sea battle puzzle","2018","Advances in Modal Logic","12","","","407","426","19","1","","https://www.scopus.com/inward/record.uri?eid=2-s2.0-85076467265&partnerID=40&md5=f6f4ddc4e3498386a01f17625bcff03c","Conference paper","Final","","Scopus","2-s2.0-85076467265"
"Skvortsov D.","Skvortsov, Dmitrij (8571235100)","8571235100","A remark on the superintuitionistic predicate logic of Kripke frames of finite height with constant domains: A simpler Kripke complete logic that is not strongly complete","2018","Advances in Modal Logic","12","","","577","590","13","0","","https://www.scopus.com/inward/record.uri?eid=2-s2.0-85076474868&partnerID=40&md5=ef3dc5a51e688dd92682c6bd07d63294","Conference paper","Final","","Scopus","2-s2.0-85076474868"
"Rybakov M.; Shkatov D.","Rybakov, Mikhail (55114172200); Shkatov, Dmitry (14058982200)","55114172200; 14058982200","Algorithmic properties of first-order modal logics of the natural number line in restricted languages","2020","Advances in Modal Logic","13","","","523","539","16","10","","https://www.scopus.com/inward/record.uri?eid=2-s2.0-85093534975&partnerID=40&md5=aa9a57d163eaf12fac26d5164ae576bb","Conference paper","Final","","Scopus","2-s2.0-85093534975"
"Alassaf R.; Schmidt R.A.; Sattler U.","Alassaf, Ruba (57200093123); Schmidt, Renate A. (36020771500); Sattler, Uli (10241248300)","57200093123; 36020771500; 10241248300","Saturation-Based Uniform Interpolation for Multi-Modal Logics","2022","Advances in Modal Logic","14","","","37","57","20","0","","https://www.scopus.com/inward/record.uri?eid=2-s2.0-85184346700&partnerID=40&md5=c466493b4a030dd618b877d60aad0a9a","Conference paper","Final","","Scopus","2-s2.0-85184346700"
