"Authors","Author full names","Author(s) ID","Title","Year","Source title","Volume","Issue","Art. No.","Page start","Page end","Page count","Cited by","DOI","Link","Document Type","Publication Stage","Open Access","Source","EID"
"Hella L.; Luosto K.; Sano K.; Virtema J.","Hella, Lauri (6603815639); Luosto, Kerkko (6507561013); Sano, Katsuhiko (26536684100); Virtema, Jonni (48862109800)","6603815639; 6507561013; 26536684100; 48862109800","The expressive power of modal dependence logic","2014","Advances in Modal Logic","10","","","294","312","18","35","","https://www.scopus.com/inward/record.uri?eid=2-s2.0-84924732216&partnerID=40&md5=b4d95541c06f6a80d69e643ff0592233","Conference paper","Final","","Scopus","2-s2.0-84924732216"
"Bakhtiari Z.; Van Ditmarsch H.; Frittella S.","Bakhtiari, Zeinab (57192992094); Van Ditmarsch, Hans (57215882990); Frittella, Sabine (56188571300)","57192992094; 57215882990; 56188571300","Algebraic semantics of refinement modal logic","2016","Advances in Modal Logic","11","","","38","57","19","1","","https://www.scopus.com/inward/record.uri?eid=2-s2.0-85019427322&partnerID=40&md5=54bba123d31c11700ec3c8fdf606efd8","Conference paper","Final","","Scopus","2-s2.0-85019427322"
"Baltag A.","Baltag, Alexandru (6506676977)","6506676977","To know is to know the value of a variable","2016","Advances in Modal Logic","11","","","135","155","20","23","","https://www.scopus.com/inward/record.uri?eid=2-s2.0-85019428535&partnerID=40&md5=1bfd31ba410cdbaef872552c46729d98","Conference paper","Final","","Scopus","2-s2.0-85019428535"
"Balbiani P.; Tinchev T.","Balbiani, Philippe (14625029700); Tinchev, Tinko (6507090495)","14625029700; 6507090495","Definability and computability for PRSPDL","2014","Advances in Modal Logic","10","","","16","33","17","9","","https://www.scopus.com/inward/record.uri?eid=2-s2.0-84924677916&partnerID=40&md5=0651befa76b81d2ce916c2e31665a301","Conference paper","Final","","Scopus","2-s2.0-84924677916"
"Fritz P.","Fritz, Peter (57016297500)","57016297500","Post completeness in congruential modal logics","2016","Advances in Modal Logic","11","","","288","301","13","4","","https://www.scopus.com/inward/record.uri?eid=2-s2.0-85019462007&partnerID=40&md5=a8eaf526149ca0d574e7f06a5bf7b551","Conference paper","Final","","Scopus","2-s2.0-85019462007"
"Zaid F.A.; Gradel E.; Jaax S.","Zaid, Faried Abu (55796177200); Gradel, Erich (35752944000); Jaax, Stephan (56548881000)","55796177200; 35752944000; 56548881000","Bisimulation safe fixed point logic","2014","Advances in Modal Logic","10","","","1","15","14","1","","https://www.scopus.com/inward/record.uri?eid=2-s2.0-84924720751&partnerID=40&md5=9d78c067e3a9b14c11382bef0ea60cc9","Conference paper","Final","","Scopus","2-s2.0-84924720751"
"Bezhanishvili N.; Ghilardi S.","Bezhanishvili, Nick (6507589688); Ghilardi, Silvio (6602896116)","6507589688; 6602896116","Multiple-conclusion rules, hypersequents syntax and step frames","2014","Advances in Modal Logic","10","","","54","73","19","9","","https://www.scopus.com/inward/record.uri?eid=2-s2.0-84924744714&partnerID=40&md5=7ab9420ebdb91de12448a997845e6f7b","Conference paper","Final","","Scopus","2-s2.0-84924744714"
"Uckelman S.L.","Uckelman, Sara L. (18435222600)","18435222600","The logic of where and while in the 13th and 14th centuries","2016","Advances in Modal Logic","11","","","535","550","15","0","","https://www.scopus.com/inward/record.uri?eid=2-s2.0-85019420899&partnerID=40&md5=cf08b2d7618758bffb8709d3c573dec5","Conference paper","Final","","Scopus","2-s2.0-85019420899"
"Marin S.; Straßburger L.","Marin, Sonia (56548338300); Straßburger, Lutz (6506786267)","56548338300; 6506786267","Label-free modular systems for classical and intuitionistic modal logics","2014","Advances in Modal Logic","10","","","387","406","19","36","","https://www.scopus.com/inward/record.uri?eid=2-s2.0-84924742890&partnerID=40&md5=7cd0e28280f4b6501d32f71b97f5db7d","Conference paper","Final","","Scopus","2-s2.0-84924742890"
"Franke M.; Galeazzi P.","Franke, Michael (36463288400); Galeazzi, Paolo (56500589100)","36463288400; 56500589100","On the evolution of choice principles","2014","CEUR Workshop Proceedings","1208","","","11","15","4","4","","https://www.scopus.com/inward/record.uri?eid=2-s2.0-84922065062&partnerID=40&md5=88c2ff6b4fa884bab459246a1ac115d6","Conference paper","Final","","Scopus","2-s2.0-84922065062"
"Baltag A.; Fiutek V.; Smets S.","Baltag, Alexandru (6506676977); Fiutek, Virginie (57194234929); Smets, Sonja (6603416658)","6506676977; 57194234929; 6603416658","Beliefs and evidence in justification models","2016","Advances in Modal Logic","11","","","156","176","20","8","","https://www.scopus.com/inward/record.uri?eid=2-s2.0-85019399362&partnerID=40&md5=0d97731014bf0610737f802a9c5dec0b","Conference paper","Final","","Scopus","2-s2.0-85019399362"
"Hampson C.","Hampson, Christopher (56342115500)","56342115500","Decidable first-order modal logics with counting quantifiers","2016","Advances in Modal Logic","11","","","382","400","18","7","","https://www.scopus.com/inward/record.uri?eid=2-s2.0-85019450701&partnerID=40&md5=06be063e0baed750112a0a55a878f5d6","Conference paper","Final","","Scopus","2-s2.0-85019450701"
"Charrier T.; Schwarzentruber F.","Charrier, Tristan (56422264300); Schwarzentruber, François (36705319600)","56422264300; 36705319600","Complexity of dynamic epistemic logic with common knowledge","2018","Advances in Modal Logic","12","","","103","122","19","5","","https://www.scopus.com/inward/record.uri?eid=2-s2.0-85074933359&partnerID=40&md5=33c70215fcd06754ac1920bec9827b63","Conference paper","Final","","Scopus","2-s2.0-85074933359"
"Wierda S.M.; Arslan B.","Wierda, Stefan M. (36656554300); Arslan, Burcu (59121886200)","36656554300; 59121886200","Modeling theory of mind in AC transfer","2014","CEUR Workshop Proceedings","1208","","","40","44","4","1","","https://www.scopus.com/inward/record.uri?eid=2-s2.0-84922009678&partnerID=40&md5=7d4aeb53f373a56b160df2b1039fb7db","Conference paper","Final","","Scopus","2-s2.0-84922009678"
"Balbiani P.; Galmiche D.","Balbiani, Philippe (14625029700); Galmiche, Didier (6603682694)","14625029700; 6603682694","About intuitionistic public announcement logic","2016","Advances in Modal Logic","11","","","97","116","19","11","","https://www.scopus.com/inward/record.uri?eid=2-s2.0-85019498253&partnerID=40&md5=511b213c7179e1cf0ee5ebd10be405ba","Conference paper","Final","","Scopus","2-s2.0-85019498253"
"Jäger G.; Marti M.","Jäger, Gerhard (57211098622); Marti, Michel (56942206100)","57211098622; 56942206100","A canonical model construction for intuitionistic distributed knowledge","2016","Advances in Modal Logic","11","","","420","434","14","7","","https://www.scopus.com/inward/record.uri?eid=2-s2.0-85019474463&partnerID=40&md5=c33cfc5be41ba138fe90bcffcf5c84de","Conference paper","Final","","Scopus","2-s2.0-85019474463"
"Gu T.; Wang Y.","Gu, Tao (57194233457); Wang, Yanjing (23468057900)","57194233457; 23468057900","""Knowing value"" logic as a normal modal logic","2016","Advances in Modal Logic","11","","","362","381","19","19","","https://www.scopus.com/inward/record.uri?eid=2-s2.0-85019406759&partnerID=40&md5=b9d630d601d944a6ca8108fefd865694","Conference paper","Final","","Scopus","2-s2.0-85019406759"
"Sedlár I.","Sedlár, Igor (26035855600)","26035855600","Propositional dynamic logic with Belnapian truth values","2016","Advances in Modal Logic","11","","","503","519","16","15","","https://www.scopus.com/inward/record.uri?eid=2-s2.0-85019485359&partnerID=40&md5=b038e0c22f3651f71060316784dc15ab","Conference paper","Final","","Scopus","2-s2.0-85019485359"
"Girard P.; Seligman J.; Liu F.","Girard, Patrick (56973386000); Seligman, Jeremy (7003486190); Liu, Fenrong (15046858900)","56973386000; 7003486190; 15046858900","General dynamic dynamic logic","2014","Advances in Modal Logic","9","","","239","260","21","32","","https://www.scopus.com/inward/record.uri?eid=2-s2.0-84886446496&partnerID=40&md5=9e620da285f79f0e6914efab898cd8ff","Conference paper","Final","","Scopus","2-s2.0-84886446496"
"Fernández-Duque D.; Joosten J.J.","Fernández-Duque, David (50861124500); Joosten, Joost J. (8719453500)","50861124500; 8719453500","Kripke models of transfinite provability logic","2014","Advances in Modal Logic","9","","","185","199","14","8","","https://www.scopus.com/inward/record.uri?eid=2-s2.0-84881357426&partnerID=40&md5=583d8dbb0a6558fac88e9bc95ccc21e7","Conference paper","Final","","Scopus","2-s2.0-84881357426"
"Van Eijck J.; Schwarzentruber F.","Van Eijck, Jan (23394398500); Schwarzentruber, François (36705319600)","23394398500; 36705319600","Epistemic probability logic simplified","2014","Advances in Modal Logic","10","","","158","177","19","15","","https://www.scopus.com/inward/record.uri?eid=2-s2.0-84924665266&partnerID=40&md5=4d04a3e480dd07e2ae8f7828e25043fe","Conference paper","Final","","Scopus","2-s2.0-84924665266"
"Bezhanishvili G.; Holliday W.H.","Bezhanishvili, Guram (6603438604); Holliday, Wesley H. (36704582700)","6603438604; 36704582700","Locales, nuclei, and Dragalin frames","2016","Advances in Modal Logic","11","","","177","196","19","15","","https://www.scopus.com/inward/record.uri?eid=2-s2.0-85019482082&partnerID=40&md5=25ba54b3cdc27330cd78897085550a3a","Conference paper","Final","","Scopus","2-s2.0-85019482082"
"Hales J.; French T.; Davies R.","Hales, James (53984444200); French, Tim (13611425300); Davies, Rowan (24757812900)","53984444200; 13611425300; 24757812900","Refinement quantified logics of knowledge and belief for multiple agents","2014","Advances in Modal Logic","9","","","317","338","21","19","","https://www.scopus.com/inward/record.uri?eid=2-s2.0-84883360768&partnerID=40&md5=b01aac0774699339c169d17e0ec9f86f","Conference paper","Final","","Scopus","2-s2.0-84883360768"
"Marti M.; Metcalfe G.","Marti, Michel (56942206100); Metcalfe, George (16316754700)","56942206100; 16316754700","A hennessy-milner property for many-valued modal logics","2014","Advances in Modal Logic","10","","","407","420","13","15","","https://www.scopus.com/inward/record.uri?eid=2-s2.0-84946166465&partnerID=40&md5=0eb4f9ae8f2f957c0a6c9732649cd112","Conference paper","Final","","Scopus","2-s2.0-84946166465"
"Madsen M.W.","Madsen, Mathias Winther (56992335800)","56992335800","An introduction to multi-agent statistics","2014","CEUR Workshop Proceedings","1208","","","16","20","4","3","","https://www.scopus.com/inward/record.uri?eid=2-s2.0-84922059698&partnerID=40&md5=5c297ac6e7e9caa21608efe512167f43","Conference paper","Final","","Scopus","2-s2.0-84922059698"
"De M.; Omori H.","De, Michael (54941780100); Omori, Hitoshi (55806776400)","54941780100; 55806776400","Classical and empirical negation in subintuitionistic logic","2016","Advances in Modal Logic","11","","","217","235","18","7","","https://www.scopus.com/inward/record.uri?eid=2-s2.0-85019414657&partnerID=40&md5=bf7f20087ff3f474ffd948b1a538fac5","Conference paper","Final","","Scopus","2-s2.0-85019414657"
"Ciabattoni A.; Genco F.A.","Ciabattoni, Agata (6701842201); Genco, Francesco A. (57006567100)","6701842201; 57006567100","Embedding formalisms: Hypersequents and two-level systems of rules","2016","Advances in Modal Logic","11","","","197","216","19","2","","https://www.scopus.com/inward/record.uri?eid=2-s2.0-85019460367&partnerID=40&md5=5653a2c4661c7c326fdafb929b01078d","Conference paper","Final","","Scopus","2-s2.0-85019460367"
"Perea A.; Tsakas E.","Perea, Andrés (8349633900); Tsakas, Elias (25923626300)","8349633900; 25923626300","Local reasoning in dynamic games","2014","CEUR Workshop Proceedings","1208","","","31","34","3","0","","https://www.scopus.com/inward/record.uri?eid=2-s2.0-84922064872&partnerID=40&md5=7c23467356d4bc9e6e97aeac071da0ea","Conference paper","Final","","Scopus","2-s2.0-84922064872"
"Kuznets R.; Lellmann B.","Kuznets, Roman (14030152500); Lellmann, Björn (42961844200)","14030152500; 42961844200","Interpolation for intermediate logics via hyper- And linear nested sequents","2018","Advances in Modal Logic","12","","","473","492","19","13","","https://www.scopus.com/inward/record.uri?eid=2-s2.0-85062358243&partnerID=40&md5=acd37fcc2c8f47da08df4875205455f0","Conference paper","Final","","Scopus","2-s2.0-85062358243"
"Marin S.; Miller D.; Volpe M.","Marin, Sonia (56548338300); Miller, Dale (56171335200); Volpe, Marco (35850908700)","56548338300; 56171335200; 35850908700","A focused framework for emulating modal proof systems","2016","Advances in Modal Logic","11","","","469","488","19","12","","https://www.scopus.com/inward/record.uri?eid=2-s2.0-85019481628&partnerID=40&md5=2dffe8944712192287b7b8d6edff0e6f","Conference paper","Final","","Scopus","2-s2.0-85019481628"
"Goldblatt R.","Goldblatt, Robert (7003578942)","7003578942","Canonicity frameworks and ultraproducts of polarities","2018","Advances in Modal Logic","12","","","143","158","15","0","","https://www.scopus.com/inward/record.uri?eid=2-s2.0-85076466002&partnerID=40&md5=38d6ebd71887fc5310c63c4d097a44bb","Conference paper","Final","","Scopus","2-s2.0-85076466002"
"Ghilardi S.; Santocanale L.","Ghilardi, Silvio (6602896116); Santocanale, Luigi (56188785700)","6602896116; 56188785700","Ruitenburg's theorem via duality and bounded bisimulations","2018","Advances in Modal Logic","12","","","277","290","13","3","","https://www.scopus.com/inward/record.uri?eid=2-s2.0-85075616227&partnerID=40&md5=95603335a96c2e9c7b0e194bcf41c706","Conference paper","Final","","Scopus","2-s2.0-85075616227"
"Diaconescu D.; Metcalfe G.; Schnüriger L.","Diaconescu, Denisa (23391723100); Metcalfe, George (16316754700); Schnüriger, Laura (57194238990)","23391723100; 16316754700; 57194238990","Axiomatizing a real-valued modal logic","2016","Advances in Modal Logic","11","","","236","251","15","3","","https://www.scopus.com/inward/record.uri?eid=2-s2.0-85019414861&partnerID=40&md5=b7c0bdc5d2ba486055334688ba4c8f43","Conference paper","Final","","Scopus","2-s2.0-85019414861"
"Goranko V.; Vester S.","Goranko, Valentin (6507595680); Vester, Steen (54411473200)","6507595680; 54411473200","Optimal decision procedures for satis-ability in fragments of alternating-time temporal logics","2014","Advances in Modal Logic","10","","","234","253","19","6","","https://www.scopus.com/inward/record.uri?eid=2-s2.0-84924736310&partnerID=40&md5=ecd2593f72f14d042294f512bd659837","Conference paper","Final","","Scopus","2-s2.0-84924736310"
"Lahav O.; Marcos J.; Zohar Y.","Lahav, Ori (36460156400); Marcos, João (7103057519); Zohar, Yoni (56291656000)","36460156400; 7103057519; 56291656000","It ain't necessarily so: Basic sequent systems for negative modalities","2016","Advances in Modal Logic","11","","","449","468","19","3","","https://www.scopus.com/inward/record.uri?eid=2-s2.0-85019466104&partnerID=40&md5=fe747f2764500415ac8f124fe2be8d10","Conference paper","Final","","Scopus","2-s2.0-85019466104"
"Ciardelli I.","Ciardelli, Ivano (35112991100)","35112991100","Modalities in the realm of questions: Axiomatizing inquisitive epistemic logic","2014","Advances in Modal Logic","10","","","94","113","19","17","","https://www.scopus.com/inward/record.uri?eid=2-s2.0-84924711774&partnerID=40&md5=074cd500d9a565909ff9439650d1b55c","Conference paper","Final","","Scopus","2-s2.0-84924711774"
"Blackburn P.; Jørgensen K.F.","Blackburn, Patrick (56273314000); Jørgensen, Klaus Frovin (55954276700)","56273314000; 55954276700","Indexical hybrid tense logic","2014","Advances in Modal Logic","9","","","144","160","16","9","","https://www.scopus.com/inward/record.uri?eid=2-s2.0-84889601845&partnerID=40&md5=180c4e101271c3c82a9e600fb07504bf","Conference paper","Final","","Scopus","2-s2.0-84889601845"
"Hampson C.; Kurucz A.","Hampson, Christopher (56342115500); Kurucz, Agi (8732161000)","56342115500; 8732161000","On modal products with the logic of 'Elsewhere'","2014","Advances in Modal Logic","9","","","339","347","8","6","","https://www.scopus.com/inward/record.uri?eid=2-s2.0-84906773134&partnerID=40&md5=993c10b830036163af7a59a01edc1192","Conference paper","Final","","Scopus","2-s2.0-84906773134"
"","","","Advances in Modal Logic","2016","Advances in Modal Logic","11","","","","","573","0","","https://www.scopus.com/inward/record.uri?eid=2-s2.0-85019473676&partnerID=40&md5=c53f35c5c3879a3cde8840db33506831","Conference review","Final","","Scopus","2-s2.0-85019473676"
"Negri S.","Negri, Sara (36907914500)","36907914500","Recent advances in proof systems for modal logic","2014","Advances in Modal Logic","10","","","421","422","1","0","","https://www.scopus.com/inward/record.uri?eid=2-s2.0-84924721112&partnerID=40&md5=8aebc0b0f5b5d2f6800ed46c351b8d89","Conference paper","Final","","Scopus","2-s2.0-84924721112"
"Balbiani P.; Van Ditmarsch H.; Herzig A.","Balbiani, Philippe (14625029700); Van Ditmarsch, Hans (57215882990); Herzig, Andreas (7004448048)","14625029700; 57215882990; 7004448048","Before announcement","2016","Advances in Modal Logic","11","","","58","77","19","6","","https://www.scopus.com/inward/record.uri?eid=2-s2.0-85019428509&partnerID=40&md5=fcc0d3254c54cddaadfd00f987554ae7","Conference paper","Final","","Scopus","2-s2.0-85019428509"
"Bílková M.; Horčík R.; Velebil J.","Bílková, Marta (56109602900); Horčík, Rostislav (14219222900); Velebil, Jiří (7801493251)","56109602900; 14219222900; 7801493251","Distributive substructural logics as coalgebraic logics over posets","2014","Advances in Modal Logic","9","","","119","142","23","3","","https://www.scopus.com/inward/record.uri?eid=2-s2.0-84904294531&partnerID=40&md5=b691dc80625df95bf9875cd054db9d05","Conference paper","Final","","Scopus","2-s2.0-84904294531"
"Michaliszyn J.; Kieroński E.","Michaliszyn, Jakub (35119322300); Kieroński, Emanuel (56292065000)","35119322300; 56292065000","Finite satisfiability of modal logic over horn definable classes of frames","2014","Advances in Modal Logic","9","","","464","482","18","1","","https://www.scopus.com/inward/record.uri?eid=2-s2.0-84906729251&partnerID=40&md5=edb0b2a1fe8b36893e4ce0d720b6f560","Conference paper","Final","","Scopus","2-s2.0-84906729251"
"Kapulkin K.; Kurz A.; Velebil J.","Kapulkin, Krzysztof (42561462300); Kurz, Alexander (35817688100); Velebil, Jiří (7801493251)","42561462300; 35817688100; 7801493251","Expressiveness of positive coalgebraic logic","2014","Advances in Modal Logic","9","","","368","385","17","20","","https://www.scopus.com/inward/record.uri?eid=2-s2.0-84906730403&partnerID=40&md5=f7191770262497268414d35794794146","Conference paper","Final","","Scopus","2-s2.0-84906730403"
"Miyazaki Y.","Miyazaki, Yutaka (36991261600)","36991261600","The structure of the lattice of normal extensions of modal logics with cyclic axioms","2016","Advances in Modal Logic","11","","","489","502","13","0","","https://www.scopus.com/inward/record.uri?eid=2-s2.0-85019401842&partnerID=40&md5=9763b24acb6aef7a3c45b03b1f48065d","Conference paper","Final","","Scopus","2-s2.0-85019401842"
"Kuznets R.; Studer T.","Kuznets, Roman (14030152500); Studer, Thomas (6602554723)","14030152500; 6602554723","Justifications, ontology, and conservativity","2014","Advances in Modal Logic","9","","","437","458","21","36","","https://www.scopus.com/inward/record.uri?eid=2-s2.0-84892929211&partnerID=40&md5=294f5a547db6a7e1c67be473b05eb554","Conference paper","Final","","Scopus","2-s2.0-84892929211"
"Balbiani P.; Tinchev T.","Balbiani, Philippe (14625029700); Tinchev, Tinko (6507090495)","14625029700; 6507090495","Unification in modal logic Alt1","2016","Advances in Modal Logic","11","","","117","134","17","11","","https://www.scopus.com/inward/record.uri?eid=2-s2.0-85019417067&partnerID=40&md5=3b7ced56acf2102b17c68128f91e6a22","Conference paper","Final","","Scopus","2-s2.0-85019417067"
"Aguilera J.P.; Fernández-Duque D.","Aguilera, Juan P. (57190608236); Fernández-Duque, David (50861124500)","57190608236; 50861124500","Verification logic: An arithmetical interpretation for negative introspection","2016","Advances in Modal Logic","11","","","1","20","19","2","","https://www.scopus.com/inward/record.uri?eid=2-s2.0-85019416817&partnerID=40&md5=66ec05e88bd6ab0dae445bf8fa3ba541","Conference paper","Final","","Scopus","2-s2.0-85019416817"
"Göller S.; Meier A.; Mundhenk M.; Schneider T.; Thomas M.; Weiß F.","Göller, Stefan (55888105300); Meier, Arne (25927331400); Mundhenk, Martin (6601961639); Schneider, Thomas (57002233100); Thomas, Michael (55472094600); Weiß, Felix (34977661000)","55888105300; 25927331400; 6601961639; 57002233100; 55472094600; 34977661000","The complexity of monotone hybrid logics over linear frames and the natural numbers","2014","Advances in Modal Logic","9","","","261","278","17","0","","https://www.scopus.com/inward/record.uri?eid=2-s2.0-84906770140&partnerID=40&md5=b2e13428742f566d2c3fb02d7d4dddeb","Conference paper","Final","","Scopus","2-s2.0-84906770140"
"Van Emde Boas P.","Van Emde Boas, Peter (6602687382)","6602687382","Theory-of-Mind reasoning in Ancient China","2014","CEUR Workshop Proceedings","1208","","","6","10","4","1","","https://www.scopus.com/inward/record.uri?eid=2-s2.0-84922033038&partnerID=40&md5=2e01a8a1c8f3fc0f39408ce1c2fa6991","Conference paper","Final","","Scopus","2-s2.0-84922033038"
"Carreiro F.; Venema Y.","Carreiro, Facundo (37123555700); Venema, Yde (6603586695)","37123555700; 6603586695","PDL inside the μcalculus: A syntactic and an automata-theoretic characterization","2014","Advances in Modal Logic","10","","","74","93","19","11","","https://www.scopus.com/inward/record.uri?eid=2-s2.0-84924670884&partnerID=40&md5=7fb54fbd7dd7c2f24e6396dcaad99847","Conference paper","Final","","Scopus","2-s2.0-84924670884"
"Balbiani P.; Van Ditmarsch H.; Herzig A.; De Lima T.","Balbiani, Philippe (14625029700); Van Ditmarsch, Hans (57215882990); Herzig, Andreas (7004448048); De Lima, Tiago (23090036100)","14625029700; 57215882990; 7004448048; 23090036100","Some truths are best left unsaid","2014","Advances in Modal Logic","9","","","36","54","18","11","","https://www.scopus.com/inward/record.uri?eid=2-s2.0-84906775367&partnerID=40&md5=bc545af0c0c6f6d2f8520dd200092636","Conference paper","Final","","Scopus","2-s2.0-84906775367"
"Van Benthem J.","Van Benthem, Johan (7004928801)","7004928801","Foundational issues in logical dynamics","2014","Advances in Modal Logic","9","","","95","96","1","0","","https://www.scopus.com/inward/record.uri?eid=2-s2.0-84906724494&partnerID=40&md5=222df7adf055185ec085c7b2165f1909","Conference paper","Final","","Scopus","2-s2.0-84906724494"
"Girlando M.; Negri S.; Olivetti N.; Risch V.","Girlando, M. (57191974164); Negri, S. (36907914500); Olivetti, N. (6602658033); Risch, V. (6603209659)","57191974164; 36907914500; 6602658033; 6603209659","The logic of conditional beliefs: Neighbourhood semantics and sequent calculus","2016","Advances in Modal Logic","11","","","322","341","19","6","","https://www.scopus.com/inward/record.uri?eid=2-s2.0-85019481245&partnerID=40&md5=5ec9136da66ba08b4b324f294393430d","Conference paper","Final","","Scopus","2-s2.0-85019481245"
"Arslan B.; Verbrugge R.; Taatgen N.; Hollebrandse B.","Arslan, Burcu (59121886200); Verbrugge, Rineke (6701472768); Taatgen, Niels (6602372660); Hollebrandse, Bart (16301659500)","59121886200; 6701472768; 6602372660; 16301659500","Teaching children to attribute second-order false belief: A training study","2014","CEUR Workshop Proceedings","1208","","","1","5","4","1","","https://www.scopus.com/inward/record.uri?eid=2-s2.0-84922064732&partnerID=40&md5=d30fa1fa7cba840f91d9a3c836d2dc4c","Conference paper","Final","","Scopus","2-s2.0-84922064732"
"Goré R.; Ramanayake R.","Goré, Rajeev (7102540943); Ramanayake, Revantha (55115703900)","7102540943; 55115703900","Labelled tree sequents, tree hypersequents and nested (Deep) sequents","2014","Advances in Modal Logic","9","","","279","299","20","32","","https://www.scopus.com/inward/record.uri?eid=2-s2.0-84906728299&partnerID=40&md5=5a8f4c5bd8c42d8e7010812a25a9799f","Conference paper","Final","","Scopus","2-s2.0-84906728299"
"Balbiani P.; Uridia L.","Balbiani, Philippe (14625029700); Uridia, Levan (36609287800)","14625029700; 36609287800","Completeness and definability of a modal logic interpreted over iterated strict partial orders","2014","Advances in Modal Logic","9","","","71","88","17","0","","https://www.scopus.com/inward/record.uri?eid=2-s2.0-84906763784&partnerID=40&md5=23af5484d4bcbc7d70c40747a9c35d4e","Conference paper","Final","","Scopus","2-s2.0-84906763784"
"Demri S.; Fervari R.","Demri, Stéphane (55886490100); Fervari, Raul (55360884400)","55886490100; 55360884400","On the complexity of modal separation logics","2018","Advances in Modal Logic","12","","","179","198","19","8","","https://www.scopus.com/inward/record.uri?eid=2-s2.0-85055499008&partnerID=40&md5=d2964906ffba448ddbdce172dfcc658f","Conference paper","Final","","Scopus","2-s2.0-85055499008"
"Přenosil A.","Přenosil, Adam (56548912000)","56548912000","A duality for distributive unimodal logic","2014","Advances in Modal Logic","10","","","423","438","15","2","","https://www.scopus.com/inward/record.uri?eid=2-s2.0-84924717573&partnerID=40&md5=65860d2ec6381722f0d1cb829806391b","Conference paper","Final","","Scopus","2-s2.0-84924717573"
"Van Gool S.J.","Van Gool, Sam J. (52264838800)","52264838800","Free algebras for godel-lob provability logic","2014","Advances in Modal Logic","10","","","217","233","16","2","","https://www.scopus.com/inward/record.uri?eid=2-s2.0-84908044884&partnerID=40&md5=98fc996cf67ec549eb23062b0a84392d","Conference paper","Final","","Scopus","2-s2.0-84908044884"
"Kudinov A.","Kudinov, Andrey (55117642700)","55117642700","Neighbourhood frame product KxK","2014","Advances in Modal Logic","10","","","373","386","13","2","","https://www.scopus.com/inward/record.uri?eid=2-s2.0-84924692552&partnerID=40&md5=18e9f81d903a5f218130919bca750b4d","Conference paper","Final","","Scopus","2-s2.0-84924692552"
