"Authors","Author full names","Author(s) ID","Title","Year","Source title","Volume","Issue","Art. No.","Page start","Page end","Page count","Cited by","DOI","Link","Document Type","Publication Stage","Open Access","Source","EID"
"Baader F.; Borgwardt S.; Morawska B.","Baader, Franz (26643645200); Borgwardt, Stefan (47361145500); Morawska, Barbara (6603255917)","26643645200; 47361145500; 6603255917","Computing minimal EL-unifiers is hard","2014","Advances in Modal Logic","9","","","18","35","17","0","","https://www.scopus.com/inward/record.uri?eid=2-s2.0-84906733511&partnerID=40&md5=64617fd462176e863e3206a40d3a59e1","Conference paper","Final","","Scopus","2-s2.0-84906733511"
"Hansen J.; Bolander T.; Braüner T.","Hansen, Jens (36611483400); Bolander, Thomas (8362407300); Braüner, Torben (6602679059)","36611483400; 8362407300; 6602679059","Many-valued hybrid logic","2008","Advances in Modal Logic 2006","7","","","111","132","21","5","","https://www.scopus.com/inward/record.uri?eid=2-s2.0-78049381417&partnerID=40&md5=1bcf49347734ab140b64a8625076307e","Conference paper","Final","","Scopus","2-s2.0-78049381417"
"","","","Advances in Modal Logic 2008","2008","Advances in Modal Logic 2006","7","","","","","406","0","","https://www.scopus.com/inward/record.uri?eid=2-s2.0-84858681558&partnerID=40&md5=4a7d84193866aca4e7ccccdb11cf1a0e","Conference review","Final","","Scopus","2-s2.0-84858681558"
"Tiu A.; Ianovski E.; Goré R.","Tiu, Alwen (8961912700); Ianovski, Egor (55810598700); Goré, Rajeev (7102540943)","8961912700; 55810598700; 7102540943","Grammar logics in nested sequent calculus: Proof theory and decision procedures","2014","Advances in Modal Logic","9","","","516","537","21","9","","https://www.scopus.com/inward/record.uri?eid=2-s2.0-84906735890&partnerID=40&md5=36a1495bd7cd403a6eb295c31b26c85f","Conference paper","Final","","Scopus","2-s2.0-84906735890"
"Kurz A.; Venema Y.","Kurz, Alexander (35817688100); Venema, Yde (6603586695)","35817688100; 6603586695","Coalgebraic Lindström theorems","2010","Advances in Modal Logic 2006","8","","","292","309","17","7","","https://www.scopus.com/inward/record.uri?eid=2-s2.0-84858671874&partnerID=40&md5=29b7250a51236cf3bbdccffc52ebaa25","Conference paper","Final","","Scopus","2-s2.0-84858671874"
"Bílková M.; Majer O.; Peliš M.; Restall G.","Bílková, Marta (56109602900); Majer, Ondrej (35092772000); Peliš, Michal (26035146000); Restall, Greg (16449732900)","56109602900; 35092772000; 26035146000; 16449732900","Relevant agents","2010","Advances in Modal Logic 2006","8","","","22","38","16","19","","https://www.scopus.com/inward/record.uri?eid=2-s2.0-84858633111&partnerID=40&md5=2a4119724e00ba3c6fb74422d151455b","Conference paper","Final","","Scopus","2-s2.0-84858633111"
"Goré R.; Ramanayake R.","Goré, Rajeev (7102540943); Ramanayake, Revantha (55115703900)","7102540943; 55115703900","Valentini's cut-elimination for provability logic resolved","2008","Advances in Modal Logic 2006","7","","","67","86","19","9","","https://www.scopus.com/inward/record.uri?eid=2-s2.0-78449231379&partnerID=40&md5=ce0f4fcc6e938f5374ec20287f1b397a","Conference paper","Final","","Scopus","2-s2.0-78449231379"
"Kikot S.; Shapirovsky I.; Zolin E.","Kikot, Stanislav (50262220100); Shapirovsky, Ilya (8716184900); Zolin, Evgeny (23399170500)","50262220100; 8716184900; 23399170500","Filtration safe operations on frames","2014","Advances in Modal Logic","10","","","333","352","19","5","","https://www.scopus.com/inward/record.uri?eid=2-s2.0-84924658562&partnerID=40&md5=688e9cddd672a55d547a12d58a55950d","Conference paper","Final","","Scopus","2-s2.0-84924658562"
"Gorbunov I.","Gorbunov, Igor (55113733300)","55113733300","A decidable modal logic that is finitely undecidable","2006","Advances in Modal Logic 2006","6","","","247","258","11","3","","https://www.scopus.com/inward/record.uri?eid=2-s2.0-84858629226&partnerID=40&md5=ecc9c24076a6ae6f98ad79212f3697af","Conference paper","Final","","Scopus","2-s2.0-84858629226"
"Goldblatt R.; Mares E.D.","Goldblatt, Robert (7003578942); Mares, Edwin D. (6602895467)","7003578942; 6602895467","A general semantics for quantified modal logic","2006","Advances in Modal Logic 2006","6","","","227","246","19","13","","https://www.scopus.com/inward/record.uri?eid=2-s2.0-49949103454&partnerID=40&md5=cb35d3ff57f29a59e87a78651a7db97b","Conference paper","Final","","Scopus","2-s2.0-49949103454"
"Santocanale L.; Venema Y.","Santocanale, Luigi (56188785700); Venema, Yde (6603586695)","56188785700; 6603586695","Uniform interpolation for monotone modal logic","2010","Advances in Modal Logic 2006","8","","","350","370","20","21","","https://www.scopus.com/inward/record.uri?eid=2-s2.0-84858677348&partnerID=40&md5=fcd8a1ed675167a17bce9d3084ba065c","Conference paper","Final","","Scopus","2-s2.0-84858677348"
"Herzig A.; Schwarzentruber F.","Herzig, Andreas (7004448048); Schwarzentruber, François (36705319600)","7004448048; 36705319600","Properties of logics of individual and group agency","2008","Advances in Modal Logic 2006","7","","","133","149","16","60","","https://www.scopus.com/inward/record.uri?eid=2-s2.0-79954592125&partnerID=40&md5=b6bca41a37e55d70c2146a847f9fbc2b","Conference paper","Final","","Scopus","2-s2.0-79954592125"
"Van Ditmarsch H.; French T.; Pinchinat S.","Van Ditmarsch, Hans (57215882990); French, Tim (13611425300); Pinchinat, Sophie (8661235300)","57215882990; 13611425300; 8661235300","Future event logic - Axioms and complexity","2010","Advances in Modal Logic 2006","8","","","77","99","22","21","","https://www.scopus.com/inward/record.uri?eid=2-s2.0-84858641193&partnerID=40&md5=49bfb748a49426230147048d5de9ff71","Conference paper","Final","","Scopus","2-s2.0-84858641193"
"Shapirovsky I.","Shapirovsky, Ilya (8716184900)","8716184900","Downward-directed transitive frames with universal relations","2006","Advances in Modal Logic 2006","6","","","413","428","15","1","","https://www.scopus.com/inward/record.uri?eid=2-s2.0-35848964761&partnerID=40&md5=37b103fa987b98da68f1e3f1291e0a53","Conference paper","Final","","Scopus","2-s2.0-35848964761"
"French T.; Van Ditmarsch H.","French, Tim (13611425300); Van Ditmarsch, Hans (57215882990)","13611425300; 57215882990","Undecidability for arbitrary public announcement logic","2008","Advances in Modal Logic 2006","7","","","23","42","19","53","","https://www.scopus.com/inward/record.uri?eid=2-s2.0-80053110538&partnerID=40&md5=fa5159acd66e3e29ff90c6808c0f65f4","Conference paper","Final","","Scopus","2-s2.0-80053110538"
"Fan J.; Wang Y.; Van Ditmarsch H.","Fan, Jie (56434947400); Wang, Yanjing (23468057900); Van Ditmarsch, Hans (57215882990)","56434947400; 23468057900; 57215882990","Almost necessary","2014","Advances in Modal Logic","10","","","178","196","18","30","","https://www.scopus.com/inward/record.uri?eid=2-s2.0-84914143026&partnerID=40&md5=130d108b5f56c56ffd0faad84c43299b","Conference paper","Final","","Scopus","2-s2.0-84914143026"
"Brünnler K.; Goetschi R.; Kuznets R.","Brünnler, Kai (12142790300); Goetschi, Remo (55071039700); Kuznets, Roman (14030152500)","12142790300; 55071039700; 14030152500","A syntactic realization theorem for justification logics","2010","Advances in Modal Logic 2006","8","","","39","58","19","12","","https://www.scopus.com/inward/record.uri?eid=2-s2.0-79955827589&partnerID=40&md5=4ecf3c587e3697209dfdf7d6fc76f20f","Conference paper","Final","","Scopus","2-s2.0-79955827589"
"Martin E.","Martin, Eric (55457009200)","55457009200","Quantification over names and modalities","2006","Advances in Modal Logic 2006","6","","","353","372","19","2","","https://www.scopus.com/inward/record.uri?eid=2-s2.0-84858642605&partnerID=40&md5=b98984001e4d7eaea9a30d9297c88d20","Conference paper","Final","","Scopus","2-s2.0-84858642605"
"Goré R.; Postniece L.; Tiu A.","Goré, Rajeev (7102540943); Postniece, Linda (25121653100); Tiu, Alwen (8961912700)","7102540943; 25121653100; 8961912700","Cut-elimination and proof-search for bi-intuitionistic logic using nested sequents","2008","Advances in Modal Logic 2006","7","","","43","66","23","32","","https://www.scopus.com/inward/record.uri?eid=2-s2.0-68749107899&partnerID=40&md5=5aff0fff87166360eac26dbd870d15cc","Conference paper","Final","","Scopus","2-s2.0-68749107899"
"Nguyen L.A.","Nguyen, Linh Anh (7202156782)","7202156782","On the deterministic Horn fragment of test-free PDL","2006","Advances in Modal Logic 2006","6","","","373","392","19","16","","https://www.scopus.com/inward/record.uri?eid=2-s2.0-84858665396&partnerID=40&md5=234b52bc452d80e96377eb1e12eeb0d2","Conference paper","Final","","Scopus","2-s2.0-84858665396"
"Shatrov T.","Shatrov, Timofei (55115742800)","55115742800","On the intermediate logic of open subsets of metric spaces","2008","Advances in Modal Logic 2006","7","","","305","313","8","0","","https://www.scopus.com/inward/record.uri?eid=2-s2.0-84858695972&partnerID=40&md5=6f86d21f24aa17df07e8ae4d1fe6acc5","Conference paper","Final","","Scopus","2-s2.0-84858695972"
"Alechina N.; Shkatov D.","Alechina, Natasha (6603450996); Shkatov, Dmitry (14058982200)","6603450996; 14058982200","Logics with an existential modality","2006","Advances in Modal Logic 2006","6","","","31","48","17","1","","https://www.scopus.com/inward/record.uri?eid=2-s2.0-84858638734&partnerID=40&md5=0773be9c427bb8e4ecd84edbe037aa5c","Conference paper","Final","","Scopus","2-s2.0-84858638734"
"Awodey S.; Kishida K.","Awodey, Steve (6506186089); Kishida, Kohei (53984205300)","6506186089; 53984205300","Topological completeness of first-order modal logic","2014","Advances in Modal Logic","9","","","1","17","16","4","","https://www.scopus.com/inward/record.uri?eid=2-s2.0-84906767071&partnerID=40&md5=cd97005a7256901591f150c2634a0b53","Conference paper","Final","","Scopus","2-s2.0-84906767071"
"Rivieccio U.","Rivieccio, Umberto (26632629800)","26632629800","Bilattice public announcement logic","2014","Advances in Modal Logic","10","","","459","477","18","19","","https://www.scopus.com/inward/record.uri?eid=2-s2.0-84924707242&partnerID=40&md5=71722b107382a151d7094770b969ee96","Conference paper","Final","","Scopus","2-s2.0-84924707242"
"Beklemishev L.","Beklemishev, Lev (6602096489)","6602096489","Calibrating provability logic: From modal logic to reflection calculus","2014","Advances in Modal Logic","9","","","89","94","5","21","","https://www.scopus.com/inward/record.uri?eid=2-s2.0-84885295521&partnerID=40&md5=ae8cf24ca8e21bfbf0f9a0c92dcdbd92","Conference paper","Final","","Scopus","2-s2.0-84885295521"
"Uckelman S.L.","Uckelman, Sara L. (18435222600)","18435222600","Reasoning about obligations in obligationes: A formal approach","2014","Advances in Modal Logic","10","","","553","568","15","1","","https://www.scopus.com/inward/record.uri?eid=2-s2.0-84924666677&partnerID=40&md5=4be7da63256cd26ef919a76fa222cc1f","Conference paper","Final","","Scopus","2-s2.0-84924666677"
"Governatori G.","Governatori, Guido (6602545579)","6602545579","Labelled modal tableaux","2008","Advances in Modal Logic 2006","7","","","87","110","23","3","","https://www.scopus.com/inward/record.uri?eid=2-s2.0-84858649623&partnerID=40&md5=2af075890cb128c36fca813e82e830e6","Conference paper","Final","","Scopus","2-s2.0-84858649623"
"Silvestre R.S.","Silvestre, Ricardo Sousa (8935559500)","8935559500","Modality, paraconsistency and paracompleteness","2006","Advances in Modal Logic 2006","6","","","449","467","18","5","","https://www.scopus.com/inward/record.uri?eid=2-s2.0-34748866396&partnerID=40&md5=5d74dd3cc6e69f5517e7120d99973c83","Conference paper","Final","","Scopus","2-s2.0-34748866396"
"Carreiro F.; Demri S.","Carreiro, Facundo (37123555700); Demri, Stéphane (55886490100)","37123555700; 55886490100","Beyond regularity for presburger modal logics","2014","Advances in Modal Logic","9","","","161","182","21","1","","https://www.scopus.com/inward/record.uri?eid=2-s2.0-84906726044&partnerID=40&md5=c37844c24d2085911cd5bfbc19a0f6dd","Conference paper","Final","","Scopus","2-s2.0-84906726044"
"De M.; Omori H.","De, Michael (54941780100); Omori, Hitoshi (55806776400)","54941780100; 55806776400","More on empirical negation","2014","Advances in Modal Logic","10","","","114","133","19","13","","https://www.scopus.com/inward/record.uri?eid=2-s2.0-84924666675&partnerID=40&md5=e7529801598da3f5cbc759b9ed5dc39d","Conference paper","Final","","Scopus","2-s2.0-84924666675"
"Cerrito S.; Mayer M.C.","Cerrito, Serenella (6603420058); Mayer, Marta Cialdea (7402464874)","6603420058; 7402464874","Nominal substitution at work with the global and converse modalities","2010","Advances in Modal Logic 2006","8","","","59","76","17","12","","https://www.scopus.com/inward/record.uri?eid=2-s2.0-79958225009&partnerID=40&md5=caa0b4421e166a4ae7c4dc393f440f30","Conference paper","Final","","Scopus","2-s2.0-79958225009"
"Humberstone L.","Humberstone, Lloyd (17135222300)","17135222300","Weaker-to-stronger translational embeddings in modal logic","2006","Advances in Modal Logic 2006","6","","","279","297","18","6","","https://www.scopus.com/inward/record.uri?eid=2-s2.0-38349187043&partnerID=40&md5=e8c3d61ca6a18a2c969c667266e142c3","Conference paper","Final","","Scopus","2-s2.0-38349187043"
"Ufferman E.; Góngora P.A.; Hernández-Quiroz F.","Ufferman, Eric (24475819700); Góngora, Pedro Arturo (36469919700); Hernández-Quiroz, Francisco (23392688800)","24475819700; 36469919700; 23392688800","A complete proof system for a dynamic epistemic logic based upon finite π-calculus processes","2010","Advances in Modal Logic 2006","8","","","470","482","12","1","","https://www.scopus.com/inward/record.uri?eid=2-s2.0-84858660094&partnerID=40&md5=045cbffefd2be6104726363a37a473b9","Conference paper","Final","","Scopus","2-s2.0-84858660094"
"Sheremet M.; Zakharyaschev M.; Tishkovsky D.; Wolter F.","Sheremet, Mikhail (14025132600); Zakharyaschev, Michael (6602982360); Tishkovsky, Dmitry (14025028400); Wolter, Frank (7005739306)","14025132600; 6602982360; 14025028400; 7005739306","From topology to metric: Modal logic and quantification in metric spaces","2006","Advances in Modal Logic 2006","6","","","429","448","19","5","","https://www.scopus.com/inward/record.uri?eid=2-s2.0-78649423649&partnerID=40&md5=a733a0b5392b70dfbee9eca808d7ce67","Conference paper","Final","","Scopus","2-s2.0-78649423649"
"Ghilardi S.; Lutz C.; Wolter F.; Zakharyaschev M.","Ghilardi, Silvio (6602896116); Lutz, Carsten (7103325866); Wolter, Frank (7005739306); Zakharyaschev, Michael (6602982360)","6602896116; 7103325866; 7005739306; 6602982360","Conservative extensions in modal logic","2006","Advances in Modal Logic 2006","6","","","187","207","20","20","","https://www.scopus.com/inward/record.uri?eid=2-s2.0-53049095299&partnerID=40&md5=9d9b4cb016a7bff96c84c197af5de722","Conference paper","Final","","Scopus","2-s2.0-53049095299"
"Gasquet O.; Herzig A.; Sahade M.","Gasquet, Olivier (6603269579); Herzig, Andreas (7004448048); Sahade, Mohamad (13105765500)","6603269579; 7004448048; 13105765500","Terminating modal tableaux with simple completeness proof","2006","Advances in Modal Logic 2006","6","","","167","186","19","6","","https://www.scopus.com/inward/record.uri?eid=2-s2.0-80155133784&partnerID=40&md5=e206a4326bdabb8fda819216749f2041","Conference paper","Final","","Scopus","2-s2.0-80155133784"
"Allwein G.; Harrison W.L.","Allwein, Gerard (6506539580); Harrison, William L. (35502824200)","6506539580; 35502824200","Partially-ordered modalities","2010","Advances in Modal Logic 2006","8","","","1","21","20","7","","https://www.scopus.com/inward/record.uri?eid=2-s2.0-84858653567&partnerID=40&md5=847f933afb44a11d12641b7fb4acfe24","Conference paper","Final","","Scopus","2-s2.0-84858653567"
"Maksimova L.","Maksimova, Larisa (7005714490)","7005714490","Interpolation and beth definability over the minimal logic","2014","Advances in Modal Logic","9","","","459","463","4","0","","https://www.scopus.com/inward/record.uri?eid=2-s2.0-84906772354&partnerID=40&md5=eed9651ee0bc6e5436d76cfbb1ebc1af","Conference paper","Final","","Scopus","2-s2.0-84906772354"
"Demri S.; Deters M.","Demri, Stfiephane (55886490100); Deters, Morgan (6701429046)","55886490100; 6701429046","The effects of modalities in separation logics","2014","Advances in Modal Logic","10","","","134","138","4","0","","https://www.scopus.com/inward/record.uri?eid=2-s2.0-84924707631&partnerID=40&md5=2d3af94e0929ed1c75139dc4ecc02393","Conference paper","Final","","Scopus","2-s2.0-84924707631"
"Holliday W.H.; Hoshi T.; Icard T.F., III","Holliday, Wesley H. (36704582700); Hoshi, Tomohiro (26435958500); Icard, Thomas F. (45561295100)","36704582700; 26435958500; 45561295100","A uniform logic of information dynamics","2014","Advances in Modal Logic","9","","","348","367","19","12","","https://www.scopus.com/inward/record.uri?eid=2-s2.0-84885599396&partnerID=40&md5=ce1e81de54207194d312bfe30147134c","Conference paper","Final","","Scopus","2-s2.0-84885599396"
"French T.; McCabe-Dansted J.; Reynolds M.","French, Tim (13611425300); McCabe-Dansted, John (12344980900); Reynolds, Mark (24792488500)","13611425300; 12344980900; 24792488500","Synthesis for temporal logic over the reals","2014","Advances in Modal Logic","9","","","217","238","21","12","","https://www.scopus.com/inward/record.uri?eid=2-s2.0-84906733940&partnerID=40&md5=b6732cef434742ae6343c00384f0c133","Conference paper","Final","","Scopus","2-s2.0-84906733940"
"De Putte F.V.; Klein D.","De Putte, Frederik Van (59159653200); Klein, Dominik (57014133900)","59159653200; 57014133900","Pointwise intersection in neighbourhood modal logic","2018","Advances in Modal Logic","12","","","591","610","19","2","","https://www.scopus.com/inward/record.uri?eid=2-s2.0-85076463048&partnerID=40&md5=7d1aa7d4d00b30459f0666e697e453d9","Conference paper","Final","","Scopus","2-s2.0-85076463048"
"Avron A.; Zamansky A.","Avron, Arnon (55893928900); Zamansky, Anna (8731254400)","55893928900; 8731254400","A paraconsistent view on B and S5","2016","Advances in Modal Logic","11","","","21","37","16","5","","https://www.scopus.com/inward/record.uri?eid=2-s2.0-85018729967&partnerID=40&md5=4bf7a2aa229aec7626d151fb16268391","Conference paper","Final","","Scopus","2-s2.0-85018729967"
"Elbl B.","Elbl, Birgit (6506133708)","6506133708","A cut-free sequent calculus for the logic of subset spaces","2016","Advances in Modal Logic","11","","","268","287","19","2","","https://www.scopus.com/inward/record.uri?eid=2-s2.0-85019473402&partnerID=40&md5=ec386797c1e22f73614ddbade3d70871","Conference paper","Final","","Scopus","2-s2.0-85019473402"
"Fernández-Duque D.","Fernández-Duque, David (50861124500)","50861124500","Non-finite axiomatizability of dynamic topological logic","2014","Advances in Modal Logic","9","","","200","216","16","0","","https://www.scopus.com/inward/record.uri?eid=2-s2.0-84906734591&partnerID=40&md5=24a2c8adc6e7dd35eeb8de23074047f6","Conference paper","Final","","Scopus","2-s2.0-84906734591"
"Hirsch R.; McLean B.","Hirsch, Robin (7201906651); McLean, Brett (57219635038)","7201906651; 57219635038","The temporal logic of two-dimensional Minkowski spacetime with slower-than-light accessibility is decidable","2018","Advances in Modal Logic","12","","","347","366","19","3","","https://www.scopus.com/inward/record.uri?eid=2-s2.0-85068596554&partnerID=40&md5=e8594d3f2c808ac1f9f0c7be9d0a3a50","Conference paper","Final","","Scopus","2-s2.0-85068596554"
"De Weerd H.; Verbrugge R.; Verheij B.","De Weerd, Harmen (51863447800); Verbrugge, Rineke (6701472768); Verheij, Bart (6602409964)","51863447800; 6701472768; 6602409964","The effectiveness of higher-order theory of mind in negotiations","2014","CEUR Workshop Proceedings","1208","","","35","39","4","0","","https://www.scopus.com/inward/record.uri?eid=2-s2.0-84922033013&partnerID=40&md5=11ba0b53357f6534a12da4495a10e0f4","Conference paper","Final","","Scopus","2-s2.0-84922033013"
"Goldblatt R.; Hodkinson I.","Goldblatt, Robert (7003578942); Hodkinson, Ian (36506600800)","7003578942; 36506600800","The tangled derivative logic of the real line and zero-dimensional spaces","2016","Advances in Modal Logic","11","","","342","361","19","5","","https://www.scopus.com/inward/record.uri?eid=2-s2.0-85019454211&partnerID=40&md5=00474ecd305cd4201a397e40aba70090","Conference paper","Final","","Scopus","2-s2.0-85019454211"
"Shapirovsky I.; Shehtman V.","Shapirovsky, Ilya (8716184900); Shehtman, Valentin (16470280300)","8716184900; 16470280300","Local tabularity without transitivity","2016","Advances in Modal Logic","11","","","520","534","14","5","","https://www.scopus.com/inward/record.uri?eid=2-s2.0-85019420781&partnerID=40&md5=253cb617a7a3c3446606e1a6aa6f8a5b","Conference paper","Final","","Scopus","2-s2.0-85019420781"
"Jørgensen K.F.; Blackburn P.; Bolander T.; Braüner T.","Jørgensen, Klaus Frovin (55954276700); Blackburn, Patrick (56273314000); Bolander, Thomas (8362407300); Braüner, Torben (6602679059)","55954276700; 56273314000; 8362407300; 6602679059","Synthetic completeness proofs for seligman-style tableau systems","2016","Advances in Modal Logic","11","","","302","321","19","6","","https://www.scopus.com/inward/record.uri?eid=2-s2.0-85019425434&partnerID=40&md5=a570e87957d2f00b2480cb0148ed9090","Conference paper","Final","","Scopus","2-s2.0-85019425434"
"Ten Cate B.","Ten Cate, Balder (8964763900)","8964763900","Guarded negation","2014","Advances in Modal Logic","9","","","183","184","1","0","","https://www.scopus.com/inward/record.uri?eid=2-s2.0-84906731811&partnerID=40&md5=dd3c23b4377a20af6009879ed43f1afe","Conference paper","Final","","Scopus","2-s2.0-84906731811"
"Van Eijck J.; Renne B.","Van Eijck, Jan (23394398500); Renne, Bryan (15056756400)","23394398500; 15056756400","Update, probability, knowledge and belief","2016","Advances in Modal Logic","11","","","551","570","19","4","","https://www.scopus.com/inward/record.uri?eid=2-s2.0-85019485739&partnerID=40&md5=bde8eda9221173c767f2451517fa611c","Conference paper","Final","","Scopus","2-s2.0-85019485739"
"Schmidt R.A.; Stell J.G.; Rydeheard D.","Schmidt, Renate A. (36020771500); Stell, John G. (7003694435); Rydeheard, David (21835004300)","36020771500; 7003694435; 21835004300","Axiomatic and tableau-based reasoning for Kt(H,R)","2014","Advances in Modal Logic","10","","","478","497","19","6","","https://www.scopus.com/inward/record.uri?eid=2-s2.0-84924721715&partnerID=40&md5=faffa25461f030424c44409f38d4c4b7","Conference paper","Final","","Scopus","2-s2.0-84924721715"
"Wang Y.; Fan J.","Wang, Yanjing (23468057900); Fan, Jie (56434947400)","23468057900; 56434947400","Conditionally knowing what","2014","Advances in Modal Logic","10","","","569","587","18","19","","https://www.scopus.com/inward/record.uri?eid=2-s2.0-84924679483&partnerID=40&md5=a547587bf5b17f1488249ceb69b47c01","Conference paper","Final","","Scopus","2-s2.0-84924679483"
"Reyes E.H.; Joosten J.J.","Reyes, Eduardo Hermo (57212341350); Joosten, Joost J. (8719453500)","57212341350; 8719453500","Relational semantics for the turing schmerl calculus","2018","Advances in Modal Logic","12","","","327","346","19","3","","https://www.scopus.com/inward/record.uri?eid=2-s2.0-85068588370&partnerID=40&md5=98455bb84478fd7bcee9756098a62788","Conference paper","Final","","Scopus","2-s2.0-85068588370"
"Hella L.; Vilander M.","Hella, Lauri (6603815639); Vilander, Miikka (57194237882)","6603815639; 57194237882","The succinctness of first-order logic over modal logic via a formula size game","2016","Advances in Modal Logic","11","","","401","419","18","9","","https://www.scopus.com/inward/record.uri?eid=2-s2.0-85019470642&partnerID=40&md5=522567b58fccdb8bfab7433259b24dc5","Conference paper","Final","","Scopus","2-s2.0-85019470642"
"Kracht M.","Kracht, Marcus (35837707400)","35837707400","Logics of infinite depth","2016","Advances in Modal Logic","11","","","435","448","13","0","","https://www.scopus.com/inward/record.uri?eid=2-s2.0-85019416450&partnerID=40&md5=836b11b0e6021b473f78cc0853e31d6c","Conference paper","Final","","Scopus","2-s2.0-85019416450"
"Skvortsov D.","Skvortsov, Dmitrij (8571235100)","8571235100","A remark on a peculiarity in the functor semantics for superintuitionistic predicate logics with (or without) equality","2014","Advances in Modal Logic","9","","","483","493","10","0","","https://www.scopus.com/inward/record.uri?eid=2-s2.0-84906769635&partnerID=40&md5=7f7a8318f28cefa26155afea7008d706","Conference paper","Final","","Scopus","2-s2.0-84906769635"
"","","","CEUR Workshop Proceedings","2014","CEUR Workshop Proceedings","1208","","","47p","","","0","","https://www.scopus.com/inward/record.uri?eid=2-s2.0-84922150558&partnerID=40&md5=d2101cae9a54cfdf236a2098b4cdaebd","Conference review","Final","","Scopus","2-s2.0-84922150558"
"Holliday W.H.","Holliday, Wesley H. (36704582700)","36704582700","Partiality and adjointness in modal logic","2014","Advances in Modal Logic","10","","","313","332","19","17","","https://www.scopus.com/inward/record.uri?eid=2-s2.0-84924753920&partnerID=40&md5=39fddb608032f0d4f540097b1537ab8e","Conference paper","Final","","Scopus","2-s2.0-84924753920"
"Wang Y.; Li Y.","Wang, Yanjing (23468057900); Li, Yanjun (56342915500)","23468057900; 56342915500","Not all those who wander are lost: Dynamic epistemic reasoning in navigation","2014","Advances in Modal Logic","9","","","559","580","21","12","","https://www.scopus.com/inward/record.uri?eid=2-s2.0-84906776287&partnerID=40&md5=d7b45401ef8bc6bb920d9c7b2ab06310","Conference paper","Final","","Scopus","2-s2.0-84906776287"
