"Authors","Author full names","Author(s) ID","Title","Year","Source title","Volume","Issue","Art. No.","Page start","Page end","Page count","Cited by","DOI","Link","Document Type","Publication Stage","Open Access","Source","EID"
"Fang J.; Xu C.; Sips H.; Che Y.; Zhang L.; Varbanescu A.L.","Fang, Jianbin (53984066400); Xu, Chuanfu (55841216300); Sips, Henk (7003476535); Che, Yonggang (22733331300); Zhang, Lilun (45662282500); Varbanescu, Ana Lucia (15020089900)","53984066400; 55841216300; 7003476535; 22733331300; 45662282500; 15020089900","Test-driving Intel Xeon Phi","2014","ICPE 2014 - Proceedings of the 5th ACM/SPEC International Conference on Performance Engineering","","","","137","148","11","75","10.1145/2568088.2576799","https://www.scopus.com/inward/record.uri?eid=2-s2.0-84899675168&doi=10.1145%2f2568088.2576799&partnerID=40&md5=140e59f81d3622de77b19148a81ed968","Conference paper","Final","","Scopus","2-s2.0-84899675168"
"Lengauer P.; Mössenböck H.","Lengauer, Philipp (55936581000); Mössenböck, Hanspeter (55901666200)","55936581000; 55901666200","The taming of the shrew: Increasing performance by automatic parameter tuning for Java garbage collectors","2014","ICPE 2014 - Proceedings of the 5th ACM/SPEC International Conference on Performance Engineering","","","","111","122","11","27","10.1145/2568088.2568091","https://www.scopus.com/inward/record.uri?eid=2-s2.0-84899699632&doi=10.1145%2f2568088.2568091&partnerID=40&md5=afdea9974b16cb100e61c69a65a16229","Conference paper","Final","","Scopus","2-s2.0-84899699632"
"Menth M.; Hauser F.","Menth, Michael (6603833672); Hauser, Frederik (57194178229)","6603833672; 57194178229","Demo: Time series online measurement for Python (TSOMpy)","2017","ICPE 2017 - Proceedings of the 2017 ACM/SPEC International Conference on Performance Engineering","","","","175","176","1","1","10.1145/3030207.3053673","https://www.scopus.com/inward/record.uri?eid=2-s2.0-85019020243&doi=10.1145%2f3030207.3053673&partnerID=40&md5=944f5789056648e1d0566b41086c790a","Conference paper","Final","","Scopus","2-s2.0-85019020243"
"Sreepathi S.; D'Azevedo E.; Philip B.; Worley P.","Sreepathi, Sarat (14054992500); D'Azevedo, Ed (6603062796); Philip, Bobby (14623068300); Worley, Patrick (7004403539)","14054992500; 6603062796; 14623068300; 7004403539","Communication characterization and optimization of applications using topology-aware task mapping on large supercomputers","2016","ICPE 2016 - Proceedings of the 7th ACM/SPEC International Conference on Performance Engineering","","","","225","236","11","8","10.1145/2851553.2851575","https://www.scopus.com/inward/record.uri?eid=2-s2.0-85020214431&doi=10.1145%2f2851553.2851575&partnerID=40&md5=67ff4c7ab1a9fd6a008cfb38bd23dfb2","Conference paper","Final","All Open Access; Bronze Open Access; Green Open Access","Scopus","2-s2.0-85020214431"
"Abad C.L.; Abad A.G.; Lucio L.E.","Abad, Cristina L. (22957218500); Abad, Andres G. (55965684700); Lucio, Luis E. (57194176499)","22957218500; 55965684700; 57194176499","Dynamic memory partitioning for cloud caches with heterogeneous backends","2017","ICPE 2017 - Proceedings of the 2017 ACM/SPEC International Conference on Performance Engineering","","","","87","90","3","7","10.1145/3030207.3030237","https://www.scopus.com/inward/record.uri?eid=2-s2.0-85019033799&doi=10.1145%2f3030207.3030237&partnerID=40&md5=46629328f0566be0947cb7877ba40513","Conference paper","Final","","Scopus","2-s2.0-85019033799"
"Medya S.; Cherkasova L.; Magalhaes G.; Ozonat K.; Padmanabha C.; Sarma J.; Sheikh I.","Medya, Sourav (57193524005); Cherkasova, Ludmila (7005553676); Magalhaes, Guilherme (56533619700); Ozonat, Kivanc (6506687542); Padmanabha, Chaitra (55180692400); Sarma, Jiban (57194449252); Sheikh, Imran (35318956500)","57193524005; 7005553676; 56533619700; 6506687542; 55180692400; 57194449252; 35318956500","Towards performance and scalability analysis of distributed memory programs on large-scale clusters","2016","ICPE 2016 - Proceedings of the 7th ACM/SPEC International Conference on Performance Engineering","","","","113","116","3","3","10.1145/2851553.2858669","https://www.scopus.com/inward/record.uri?eid=2-s2.0-85019445725&doi=10.1145%2f2851553.2858669&partnerID=40&md5=54473241f85e45bc1dde66bcfb809743","Conference paper","Final","","Scopus","2-s2.0-85019445725"
"Apte V.; Viswanath T.V.S.; Gawali D.; Kommireddy A.; Gupta A.","Apte, Varsha (22833682700); Viswanath, T.V.S. (57194174948); Gawali, Devidas (57194174351); Kommireddy, Akhilesh (57194176109); Gupta, Anshul (57198677239)","22833682700; 57194174948; 57194174351; 57194176109; 57198677239","AutoPerf: Automated load testing and resource usage profiling of multi-tier internet applications","2017","ICPE 2017 - Proceedings of the 2017 ACM/SPEC International Conference on Performance Engineering","","","","115","126","11","19","10.1145/3030207.3030222","https://www.scopus.com/inward/record.uri?eid=2-s2.0-85019030164&doi=10.1145%2f3030207.3030222&partnerID=40&md5=6f17587aa1c43537ce2cc86da6af8260","Conference paper","Final","","Scopus","2-s2.0-85019030164"
"Bajunaid N.; Menascé D.A.","Bajunaid, Noor (57193529273); Menascé, Daniel A. (7005921703)","57193529273; 7005921703","Analytic models of checkpointing for concurrent component-based software systems","2017","ICPE 2017 - Proceedings of the 2017 ACM/SPEC International Conference on Performance Engineering","","","","245","256","11","1","10.1145/3030207.3030209","https://www.scopus.com/inward/record.uri?eid=2-s2.0-85019012867&doi=10.1145%2f3030207.3030209&partnerID=40&md5=64f9182bd18c56f694b2711136c8ea7a","Conference paper","Final","","Scopus","2-s2.0-85019012867"
"Brataas G.; Fægri T.E.","Brataas, Gunnar (6508242707); Fægri, Tor Erlend (14022714500)","6508242707; 14022714500","Agile scalability requirements","2017","ICPE 2017 - Proceedings of the 2017 ACM/SPEC International Conference on Performance Engineering","","","","413","416","3","8","10.1145/3030207.3030240","https://www.scopus.com/inward/record.uri?eid=2-s2.0-85019038202&doi=10.1145%2f3030207.3030240&partnerID=40&md5=9c456ee837318f39f0b91b5bcfb4e9aa","Conference paper","Final","All Open Access; Bronze Open Access; Green Open Access","Scopus","2-s2.0-85019038202"
"Bondi A.B.","Bondi, André B. (14629853000)","14629853000","Incorporating software performance engineering methods and practices into the software development life cycle","2016","ICPE 2016 - Proceedings of the 7th ACM/SPEC International Conference on Performance Engineering","","","","327","330","3","6","10.1145/2851553.2858668","https://www.scopus.com/inward/record.uri?eid=2-s2.0-84969161544&doi=10.1145%2f2851553.2858668&partnerID=40&md5=77d0107949fcdda4845ca6f1bf0d6808","Conference paper","Final","","Scopus","2-s2.0-84969161544"
"Mathew B.; Chahal D.","Mathew, Benny (14624276900); Chahal, Dheeraj (57147492400)","14624276900; 57147492400","Deside: Discrete event simulation developers environment","2017","ICPE 2017 - Proceedings of the 2017 ACM/SPEC International Conference on Performance Engineering","","","","173","174","1","4","10.1145/3030207.3053672","https://www.scopus.com/inward/record.uri?eid=2-s2.0-85019027553&doi=10.1145%2f3030207.3053672&partnerID=40&md5=f29d713fca56ab8fd6cac9c8368d2e36","Conference paper","Final","","Scopus","2-s2.0-85019027553"
"Park C.; Lee S.; Won Y.; Ahn S.","Park, Changhyun (57224662912); Lee, Seongjin (24824950900); Won, Youjip (7102129143); Ahn, Soohan (8351204800)","57224662912; 24824950900; 7102129143; 8351204800","Practical implication of analytical models for SSD write amplification","2017","ICPE 2017 - Proceedings of the 2017 ACM/SPEC International Conference on Performance Engineering","","","","257","262","5","3","10.1145/3030207.3030219","https://www.scopus.com/inward/record.uri?eid=2-s2.0-85019051418&doi=10.1145%2f3030207.3030219&partnerID=40&md5=78489a2b9331a0bb621421ec3fb15c47","Conference paper","Final","","Scopus","2-s2.0-85019051418"
"Molka D.; Schöne R.; Hackenberg D.; Nagel W.E.","Molka, Daniel (35175078100); Schöne, Robert (15019783300); Hackenberg, Daniel (15019453000); Nagel, Wolfgang E. (9435404200)","35175078100; 15019783300; 15019453000; 9435404200","Detecting memory-boundedness with hardware performance counters","2017","ICPE 2017 - Proceedings of the 2017 ACM/SPEC International Conference on Performance Engineering","","","","27","38","11","27","10.1145/3030207.3030223","https://www.scopus.com/inward/record.uri?eid=2-s2.0-85019043873&doi=10.1145%2f3030207.3030223&partnerID=40&md5=feded663d5d25b9560f2c1d2ff10b83b","Conference paper","Final","All Open Access; Green Open Access","Scopus","2-s2.0-85019043873"
"Menth M.; Hauser F.","Menth, Michael (6603833672); Hauser, Frederik (57194178229)","6603833672; 57194178229","On moving averages, histograms and time-dependent rates for online measurement","2017","ICPE 2017 - Proceedings of the 2017 ACM/SPEC International Conference on Performance Engineering","","","","103","114","11","15","10.1145/3030207.3030212","https://www.scopus.com/inward/record.uri?eid=2-s2.0-85019030979&doi=10.1145%2f3030207.3030212&partnerID=40&md5=629a57983be8daf387cff2747bd924b3","Conference paper","Final","All Open Access; Bronze Open Access","Scopus","2-s2.0-85019030979"
"Ferme V.; Pautasso C.","Ferme, Vincenzo (55319324200); Pautasso, Cesare (7801368483)","55319324200; 7801368483","Integrating Faban with Docker for performance benchmarking: [Demonstration paper]","2016","ICPE 2016 - Proceedings of the 7th ACM/SPEC International Conference on Performance Engineering","","","","129","130","1","5","10.1145/2851553.2858676","https://www.scopus.com/inward/record.uri?eid=2-s2.0-84976605223&doi=10.1145%2f2851553.2858676&partnerID=40&md5=a2777e30587122400309ca1a273022f6","Conference paper","Final","","Scopus","2-s2.0-84976605223"
"Di Pompeo D.; Incerto E.; Muttillo V.; Pomante L.; Valente G.","Di Pompeo, Daniele (57188727238); Incerto, Emilio (56815042800); Muttillo, Vittoriano (56805275400); Pomante, Luigi (55905317800); Valente, Giacomo (57188678594)","57188727238; 56815042800; 56805275400; 55905317800; 57188678594","An efficient performance-driven approach for HW/SW Co-design","2017","ICPE 2017 - Proceedings of the 2017 ACM/SPEC International Conference on Performance Engineering","","","","323","326","3","11","10.1145/3030207.3030239","https://www.scopus.com/inward/record.uri?eid=2-s2.0-85019048083&doi=10.1145%2f3030207.3030239&partnerID=40&md5=a398c9351b1ea6dccabc8c322460b9cb","Conference paper","Final","","Scopus","2-s2.0-85019048083"
"Shang Z.; Meng T.; Wolter K.","Shang, Zhihao (56132381700); Meng, Tianhui (56727664300); Wolter, Katinka (57195753362)","56132381700; 56727664300; 57195753362","Hyperstar2: Easy distribution fitting of correlated data","2017","ICPE 2017 - Proceedings of the 2017 ACM/SPEC International Conference on Performance Engineering","","","","139","142","3","1","10.1145/3030207.3030243","https://www.scopus.com/inward/record.uri?eid=2-s2.0-85019014416&doi=10.1145%2f3030207.3030243&partnerID=40&md5=e33170acb304dc7d7777d9f460d0c9ab","Conference paper","Final","","Scopus","2-s2.0-85019014416"
"Costa D.; Andrzejak A.; Seboek J.; Lo D.","Costa, Diego (57198365954); Andrzejak, Artur (6602719342); Seboek, Janos (57194176237); Lo, David (35269388000)","57198365954; 6602719342; 57194176237; 35269388000","Empirical study of usage and performance of Java collections","2017","ICPE 2017 - Proceedings of the 2017 ACM/SPEC International Conference on Performance Engineering","","","","389","400","11","33","10.1145/3030207.3030221","https://www.scopus.com/inward/record.uri?eid=2-s2.0-85019030331&doi=10.1145%2f3030207.3030221&partnerID=40&md5=85092913ee185615686b17cbcbf6541f","Conference paper","Final","All Open Access; Bronze Open Access; Green Open Access","Scopus","2-s2.0-85019030331"
"Fioravanti S.; Mattolini S.; Patara F.; Vicario E.","Fioravanti, Sara (57194240438); Mattolini, Simone (57194456824); Patara, Fulvio (56229356800); Vicario, Enrico (7004018543)","57194240438; 57194456824; 56229356800; 7004018543","Experimental performance evaluation of different data models for a reflection software architecture over NoSQL persistence layers","2016","ICPE 2016 - Proceedings of the 7th ACM/SPEC International Conference on Performance Engineering","","","","297","308","11","3","10.1145/2851553.2851561","https://www.scopus.com/inward/record.uri?eid=2-s2.0-85019473918&doi=10.1145%2f2851553.2851561&partnerID=40&md5=0bfc7009ce5d00b7d3c1574c19027bea","Conference paper","Final","","Scopus","2-s2.0-85019473918"
"Rygielski P.; Simko V.; Sittner F.; Aschenbrenner D.; Kounev S.; Schilling K.","Rygielski, Piotr (36629236800); Simko, Viliam (35106006400); Sittner, Felix (56071604600); Aschenbrenner, Doris (56071739200); Kounev, Samuel (23397538000); Schilling, Klaus (35303461000)","36629236800; 35106006400; 56071604600; 56071739200; 23397538000; 35303461000","Automated extraction of network traffic models suitable for performance simulation","2016","ICPE 2016 - Proceedings of the 7th ACM/SPEC International Conference on Performance Engineering","","","","27","35","8","3","10.1145/2851553.2851570","https://www.scopus.com/inward/record.uri?eid=2-s2.0-85020162916&doi=10.1145%2f2851553.2851570&partnerID=40&md5=bd505e578a729c234e5652baa2d54e71","Conference paper","Final","","Scopus","2-s2.0-85020162916"
"Fitzek S.; Lengauer P.; Mössenböck H.","Fitzek, Stefan (57194171024); Lengauer, Philipp (55936581000); Mössenböck, Hanspeter (55901666200)","57194171024; 55936581000; 55901666200","DuckTracks: Path-based object allocation tracking","2017","ICPE 2017 - Proceedings of the 2017 ACM/SPEC International Conference on Performance Engineering","","","","327","330","3","0","10.1145/3030207.3030235","https://www.scopus.com/inward/record.uri?eid=2-s2.0-85019052186&doi=10.1145%2f3030207.3030235&partnerID=40&md5=2fc62fd27ab039a8cf416eda81c143b1","Conference paper","Final","","Scopus","2-s2.0-85019052186"
"Eisenman A.; Cherkasova L.; Magalhaes G.; Cai Q.; Faraboschi P.; Katti S.","Eisenman, Assaf (57193072463); Cherkasova, Ludmila (7005553676); Magalhaes, Guilherme (56533619700); Cai, Qiong (57193057917); Faraboschi, Paolo (6603755423); Katti, Sachin (8618918900)","57193072463; 7005553676; 56533619700; 57193057917; 6603755423; 8618918900","Parallel graph processing: Prejudice and state of the art","2016","ICPE 2016 - Proceedings of the 7th ACM/SPEC International Conference on Performance Engineering","","","","85","90","5","13","10.1145/2851553.2851572","https://www.scopus.com/inward/record.uri?eid=2-s2.0-85015214213&doi=10.1145%2f2851553.2851572&partnerID=40&md5=4c080997342c9087af18780bebe7e70f","Conference paper","Final","","Scopus","2-s2.0-85015214213"
"Baset S.; Silva M.; Wakou N.","Baset, Salman (15076508200); Silva, Marcio (16437372100); Wakou, Nicholas (35185572700)","15076508200; 16437372100; 35185572700","SPEC cloud™ IaaS 2016 benchmark","2017","ICPE 2017 - Proceedings of the 2017 ACM/SPEC International Conference on Performance Engineering","","","","423","","","10","10.1145/3030207.3053675","https://www.scopus.com/inward/record.uri?eid=2-s2.0-85019029109&doi=10.1145%2f3030207.3053675&partnerID=40&md5=876a0fdda5a01911c25fb28cf585ebc1","Conference paper","Final","","Scopus","2-s2.0-85019029109"
"Horký V.; Kotrč J.; Libič P.; Tůma P.","Horký, Vojtěch (57194446578); Kotrč, Jaroslav (55905104800); Libič, Peter (35422387800); Tůma, Petr (57050416200)","57194446578; 55905104800; 35422387800; 57050416200","Analysis of overhead in dynamic Java performance monitoring","2016","ICPE 2016 - Proceedings of the 7th ACM/SPEC International Conference on Performance Engineering","","","","275","286","11","10","10.1145/2851553.2851569","https://www.scopus.com/inward/record.uri?eid=2-s2.0-85020192019&doi=10.1145%2f2851553.2851569&partnerID=40&md5=79056896f7fd8e61b3db249d30c280f2","Conference paper","Final","","Scopus","2-s2.0-85020192019"
"","","","ICPE 2016 - Proceedings of the 7th ACM/SPEC International Conference on Performance Engineering","2016","ICPE 2016 - Proceedings of the 7th ACM/SPEC International Conference on Performance Engineering","","","","","","331","0","","https://www.scopus.com/inward/record.uri?eid=2-s2.0-85020201810&partnerID=40&md5=3ad1b25def8570759a0ca6ff62c42f71","Conference review","Final","","Scopus","2-s2.0-85020201810"
"Khoshkbarforoushha A.; Ranjan R.","Khoshkbarforoushha, Alireza (35753330800); Ranjan, Rajiv (57197711780)","35753330800; 57197711780","Resource and performance distribution prediction for large scale analytics queries","2016","ICPE 2016 - Proceedings of the 7th ACM/SPEC International Conference on Performance Engineering","","","","49","54","5","6","10.1145/2851553.2851578","https://www.scopus.com/inward/record.uri?eid=2-s2.0-85019014140&doi=10.1145%2f2851553.2851578&partnerID=40&md5=e1efbb2fdcadcddf9c9cc151e294052c","Conference paper","Final","","Scopus","2-s2.0-85019014140"
"Lengauer P.; Bitto V.; Mössenböck H.","Lengauer, Philipp (55936581000); Bitto, Verena (56099896600); Mössenböck, Hanspeter (55901666200)","55936581000; 56099896600; 55901666200","Efficient and viable handling of large object traces","2016","ICPE 2016 - Proceedings of the 7th ACM/SPEC International Conference on Performance Engineering","","","","249","260","11","7","10.1145/2851553.2851555","https://www.scopus.com/inward/record.uri?eid=2-s2.0-85020214332&doi=10.1145%2f2851553.2851555&partnerID=40&md5=fca68e7f80d7003f8f525323aba49fca","Conference paper","Final","","Scopus","2-s2.0-85020214332"
"Bondi A.B.","Bondi, André B. (14629853000)","14629853000","Challenges with applying performance testing methods for systems deployed on shared environments with indeterminate competing workloads: Position paper","2016","ICPE 2016 Companion - Companion Publication for 7th ACM/SPEC International Conference on Performance Engineering","","","","41","44","3","3","10.1145/2859889.2859895","https://www.scopus.com/inward/record.uri?eid=2-s2.0-84969285218&doi=10.1145%2f2859889.2859895&partnerID=40&md5=4713eb972e63174f1f84e6e41184689e","Conference paper","Final","","Scopus","2-s2.0-84969285218"
"Qiu Z.; Pérez J.F.; Harrison P.G.","Qiu, Zhan (56714639400); Pérez, Juan F. (14523278100); Harrison, Peter G. (7401612242)","56714639400; 14523278100; 7401612242","Tackling latency via replication in distributed systems","2016","ICPE 2016 - Proceedings of the 7th ACM/SPEC International Conference on Performance Engineering","","","","197","208","11","6","10.1145/2851553.2851562","https://www.scopus.com/inward/record.uri?eid=2-s2.0-85020211058&doi=10.1145%2f2851553.2851562&partnerID=40&md5=cc1399c4ca8875a0532cda6e1e3463aa","Conference paper","Final","All Open Access; Green Open Access","Scopus","2-s2.0-85020211058"
"Chahal D.; Kumar M.; Nambiar M.","Chahal, Dheeraj (57147492400); Kumar, Mukund (57201849225); Nambiar, Manoj (24833362900)","57147492400; 57201849225; 24833362900","Perfext++: Performance extrapolation of IO intensive workloads","2017","ICPE 2017 - Proceedings of the 2017 ACM/SPEC International Conference on Performance Engineering","","","","171","172","1","2","10.1145/3030207.3053669","https://www.scopus.com/inward/record.uri?eid=2-s2.0-85019033571&doi=10.1145%2f3030207.3053669&partnerID=40&md5=ae4681d2efc5061e22a93a0d82508d54","Conference paper","Final","","Scopus","2-s2.0-85019033571"
"Perez-Palacin D.; Mirandola R.; Scoppetta M.","Perez-Palacin, Diego (35422750700); Mirandola, Raffaela (56240209400); Scoppetta, Marco (57189323063)","35422750700; 56240209400; 57189323063","Simulation of techniques to improve the utilization of cloud elasticity in workload-aware adaptive software","2016","ICPE 2016 Companion - Companion Publication for 7th ACM/SPEC International Conference on Performance Engineering","","","","51","56","5","4","10.1145/2859889.2859897","https://www.scopus.com/inward/record.uri?eid=2-s2.0-84969195339&doi=10.1145%2f2859889.2859897&partnerID=40&md5=84e866c32aff69a8ffc05cd9dfe81fd2","Conference paper","Final","","Scopus","2-s2.0-84969195339"
"Hashimoto M.; Terai M.; Maeda T.; Minami K.","Hashimoto, Masatomo (24605162600); Terai, Masaaki (55523998200); Maeda, Toshiyuki (36691858700); Minami, Kazuo (54584178600)","24605162600; 55523998200; 36691858700; 54584178600","An empirical study of computation-intensive loops for identifying and classifying loop kernels","2017","ICPE 2017 - Proceedings of the 2017 ACM/SPEC International Conference on Performance Engineering","","","","361","372","11","2","10.1145/3030207.3030217","https://www.scopus.com/inward/record.uri?eid=2-s2.0-85019036442&doi=10.1145%2f3030207.3030217&partnerID=40&md5=4077df52822661fdd5995701e79b40d9","Conference paper","Final","","Scopus","2-s2.0-85019036442"
"Michael N.; Ramannavar N.; Shen Y.; Patil S.; Sung J.-L.","Michael, Nicolas (56506637700); Ramannavar, Nitin (57194170429); Shen, Yixiao (56505847800); Patil, Sheetal (57208826928); Sung, Jan-Lung (56650518600)","56506637700; 57194170429; 56505847800; 57208826928; 56650518600","Cloudperf: A performance test framework for distributed and dynamic multi-tenant environments","2017","ICPE 2017 - Proceedings of the 2017 ACM/SPEC International Conference on Performance Engineering","","","","189","200","11","11","10.1145/3030207.3044530","https://www.scopus.com/inward/record.uri?eid=2-s2.0-85019050903&doi=10.1145%2f3030207.3044530&partnerID=40&md5=148aeec793c9837415bdbd774ea07a51","Conference paper","Final","","Scopus","2-s2.0-85019050903"
"Reichelt D.G.; Kühne S.","Reichelt, David Georg (56382181200); Kühne, Stefan (15829351600)","56382181200; 15829351600","Empirical analysis of performance problems at code level","2016","ICPE 2016 - Proceedings of the 7th ACM/SPEC International Conference on Performance Engineering","","","","117","120","3","1","10.1145/2851553.2892038","https://www.scopus.com/inward/record.uri?eid=2-s2.0-85020223777&doi=10.1145%2f2851553.2892038&partnerID=40&md5=12fece3a0a2019027e2a33f8048aca06","Conference paper","Final","","Scopus","2-s2.0-85020223777"
"Norris B.; Spear W.; Malony A.","Norris, Boyana (7101804546); Spear, Wyatt (15045967300); Malony, Allen (7004220494)","7101804546; 15045967300; 7004220494","Performance analysis of applications in the context of architectural rooflines","2017","ICPE 2017 - Proceedings of the 2017 ACM/SPEC International Conference on Performance Engineering","","","","345","348","3","1","10.1145/3030207.3030232","https://www.scopus.com/inward/record.uri?eid=2-s2.0-85019048665&doi=10.1145%2f3030207.3030232&partnerID=40&md5=863266e61eba3b260406d1ecd5acf3c6","Conference paper","Final","","Scopus","2-s2.0-85019048665"
"Spinner S.; Walter J.; Kounev S.","Spinner, Simon (36696996300); Walter, Jürgen (56939872200); Kounev, Samuel (23397538000)","36696996300; 56939872200; 23397538000","A reference architecture for online performance model extraction in virtualized environments","2016","ICPE 2016 Companion - Companion Publication for 7th ACM/SPEC International Conference on Performance Engineering","","","","57","62","5","12","10.1145/2859889.2859893","https://www.scopus.com/inward/record.uri?eid=2-s2.0-84969268589&doi=10.1145%2f2859889.2859893&partnerID=40&md5=23fd08e82db786a521a4b1f59bd2571d","Conference paper","Final","","Scopus","2-s2.0-84969268589"
"Wang Q.; Cherkasova L.; Li J.; Volos H.","Wang, Qi (57194450105); Cherkasova, Ludmila (7005553676); Li, Jun (55885632600); Volos, Haris (57204378333)","57194450105; 7005553676; 55885632600; 57204378333","Interconnect emulator for aiding performance analysis of distributed memory applications","2016","ICPE 2016 - Proceedings of the 7th ACM/SPEC International Conference on Performance Engineering","","","","75","83","8","3","10.1145//2851553.2851574","https://www.scopus.com/inward/record.uri?eid=2-s2.0-85020183774&doi=10.1145%2f%2f2851553.2851574&partnerID=40&md5=624f38c95b688c8ae7f2741e5a9d90e5","Conference paper","Final","","Scopus","2-s2.0-85020183774"
"Singhal R.; Kunde S.","Singhal, Rekha (36069730400); Kunde, Shruti (55935168700)","36069730400; 55935168700","Technology migration challenges in a big data architecture stack","2017","ICPE 2017 - Proceedings of the 2017 ACM/SPEC International Conference on Performance Engineering","","","","159","160","1","1","10.1145/3030207.3053670","https://www.scopus.com/inward/record.uri?eid=2-s2.0-85019031966&doi=10.1145%2f3030207.3053670&partnerID=40&md5=a2c91b88b9155bf648d77810377f29c4","Conference paper","Final","","Scopus","2-s2.0-85019031966"
"Bause F.; Buchholz P.; May J.","Bause, Falko (6603195355); Buchholz, Peter (57193779606); May, Johannes (57194171281)","6603195355; 57193779606; 57194171281","A tool supporting the analytical evaluation of service level agreements","2017","ICPE 2017 - Proceedings of the 2017 ACM/SPEC International Conference on Performance Engineering","","","","233","244","11","3","10.1145/3030207.3030215","https://www.scopus.com/inward/record.uri?eid=2-s2.0-85019011720&doi=10.1145%2f3030207.3030215&partnerID=40&md5=1a26568ac884b689fe50d6977704fee2","Conference paper","Final","","Scopus","2-s2.0-85019011720"
"Binder W.; Cortellessa V.","Binder, Walter (7005259851); Cortellessa, Vittorio (6603764364)","7005259851; 6603764364","ICPE 2017 general chairs' welcome","2017","ICPE 2017 - Proceedings of the 2017 ACM/SPEC International Conference on Performance Engineering","","","","iii","","","0","10.1145/3030207.3053656","https://www.scopus.com/inward/record.uri?eid=2-s2.0-85112399086&doi=10.1145%2f3030207.3053656&partnerID=40&md5=8dcc82e1b0d5bcfa8c9be09949522888","Editorial","Final","","Scopus","2-s2.0-85112399086"
