"Authors","Author full names","Author(s) ID","Title","Year","Source title","Volume","Issue","Art. No.","Page start","Page end","Page count","Cited by","DOI","Link","Document Type","Publication Stage","Open Access","Source","EID"
"Raskar S.; Monsalve Diaz J.M.; Applencourt T.; Kumaran K.; Gao G.","Raskar, Siddhisanket (57211109742); Monsalve Diaz, Jose M (57211111112); Applencourt, Thomas (56085573300); Kumaran, Kalyan (35334644800); Gao, Guang (7403170980)","57211109742; 57211111112; 56085573300; 35334644800; 7403170980","Implementation of Dataflow Software Pipelining for Codelet Model","2023","ICPE 2023 - Proceedings of the 2023 ACM/SPEC International Conference on Performance Engineering","","","","161","172","11","2","10.1145/3578244.3583734","https://www.scopus.com/inward/record.uri?eid=2-s2.0-85158085878&doi=10.1145%2f3578244.3583734&partnerID=40&md5=a188ace15fe88654ae5b7afb81b9e1bb","Conference paper","Final","","Scopus","2-s2.0-85158085878"
"Ngo K.L.; Mukherjee J.; Jiang Z.M.; Litoiu M.","Ngo, Kim Long (57566457300); Mukherjee, Joydeep (56242469200); Jiang, Zhen Ming (57197839751); Litoiu, Marin (6603658203)","57566457300; 56242469200; 57197839751; 6603658203","Evaluating the Scalability and Elasticity of Function as a Service Platform","2022","ICPE 2022 - Proceedings of the 2022 ACM/SPEC International Conference on Performance Engineering","","","","117","124","7","4","10.1145/3489525.3511682","https://www.scopus.com/inward/record.uri?eid=2-s2.0-85128592950&doi=10.1145%2f3489525.3511682&partnerID=40&md5=b12e8a85d107d8bf324ca0998b538703","Conference paper","Final","","Scopus","2-s2.0-85128592950"
"Beierlieb L.; Bauer A.; Leppich R.; Iffländer L.; Kounev S.","Beierlieb, Lukas (57215411164); Bauer, André (57194177145); Leppich, Robert (57201978506); Iffländer, Lukas (56368532200); Kounev, Samuel (23397538000)","57215411164; 57194177145; 57201978506; 56368532200; 23397538000","Efficient Data Processing: Assessing the Performance of Different Programming Languages","2023","ICPE 2023 - Companion of the 2023 ACM/SPEC International Conference on Performance Engineering","","","","83","87","4","2","10.1145/3578245.3584691","https://www.scopus.com/inward/record.uri?eid=2-s2.0-85158818499&doi=10.1145%2f3578245.3584691&partnerID=40&md5=aaaab60424bf1a316027b3cafb625ef5","Conference paper","Final","","Scopus","2-s2.0-85158818499"
"Phalak C.; Chahal D.; Sen A.; Mishra M.; Singhal R.","Phalak, Chetan (39861982700); Chahal, Dheeraj (57147492400); Sen, Aniruddha (57846562500); Mishra, Mayank (57205914416); Singhal, Rekha (36069730400)","39861982700; 57147492400; 57846562500; 57205914416; 36069730400","Maple: Model aggregation and prediction for learned ecosystem","2022","ICPE 2022 - Companion of the 2022 ACM/SPEC International Conference on Performance Engineering","","","","17","18","1","0","10.1145/3491204.3527497","https://www.scopus.com/inward/record.uri?eid=2-s2.0-85136072336&doi=10.1145%2f3491204.3527497&partnerID=40&md5=103a9ebff94c57523a6c53d03196a901","Conference paper","Final","","Scopus","2-s2.0-85136072336"
"Rapp M.; Scheerer M.; Reussner R.","Rapp, Martina (57219432935); Scheerer, Max (57198352295); Reussner, Ralf (6603589366)","57219432935; 57198352295; 6603589366","Design-time Performability Optimization of Runtime Adaptation Strategies","2022","ICPE 2022 - Companion of the 2022 ACM/SPEC International Conference on Performance Engineering","","","","113","120","7","2","10.1145/3491204.3527471","https://www.scopus.com/inward/record.uri?eid=2-s2.0-85136032992&doi=10.1145%2f3491204.3527471&partnerID=40&md5=38c6a87ff6e7528379128a255d1fa892","Conference paper","Final","","Scopus","2-s2.0-85136032992"
"Velten M.; Schöne R.; Ilsche T.; Hackenberg D.","Velten, Markus (57210798121); Schöne, Robert (15019783300); Ilsche, Thomas (36662073600); Hackenberg, Daniel (15019453000)","57210798121; 15019783300; 36662073600; 15019453000","Memory Performance of AMD EPYC Rome and Intel Cascade Lake SP Server Processors","2022","ICPE 2022 - Proceedings of the 2022 ACM/SPEC International Conference on Performance Engineering","","","","165","175","10","22","10.1145/3489525.3511689","https://www.scopus.com/inward/record.uri?eid=2-s2.0-85128652028&doi=10.1145%2f3489525.3511689&partnerID=40&md5=1873c6182115448aac26ba3a14b46551","Conference paper","Final","All Open Access; Green Open Access","Scopus","2-s2.0-85128652028"
"Hadry M.; Lesch V.; Kounev S.","Hadry, Marius (57224452451); Lesch, Veronika (57203269817); Kounev, Samuel (23397538000)","57224452451; 57203269817; 23397538000","Fade: Towards flexible and adaptive distance estimation considering obstacles","2022","ICPE 2022 - Companion of the 2022 ACM/SPEC International Conference on Performance Engineering","","","","1","5","4","0","10.1145/3491204.3527493","https://www.scopus.com/inward/record.uri?eid=2-s2.0-85135995337&doi=10.1145%2f3491204.3527493&partnerID=40&md5=2cbb75822208e084a588ba334b9c3c32","Conference paper","Final","","Scopus","2-s2.0-85135995337"
"De Lama Sanchez N.; Haase P.; Roman D.; Prodan R.","De Lama Sanchez, Nuria (58243128800); Haase, Peter (7005272447); Roman, Dumitru (23467687800); Prodan, Radu (8858675500)","58243128800; 7005272447; 23467687800; 8858675500","Boosting the Impact of Extreme and Sustainable Graph Processing for Urgent Societal Challenges in Europe Graph-Massivizer: A Horizon Europe Project","2023","ICPE 2023 - Companion of the 2023 ACM/SPEC International Conference on Performance Engineering","","","","233","238","5","3","10.1145/3578245.3585334","https://www.scopus.com/inward/record.uri?eid=2-s2.0-85158859164&doi=10.1145%2f3578245.3585334&partnerID=40&md5=83daafe305649c9ecf04e9b7bef093d9","Conference paper","Final","All Open Access; Bronze Open Access","Scopus","2-s2.0-85158859164"
"Leivadeas A.; Pitaev N.; Falkner M.","Leivadeas, Aris (54929931000); Pitaev, Nikolai (57195626482); Falkner, Matthias (57170367000)","54929931000; 57195626482; 57170367000","Analyzing the Performance of SD-WAN Enabled Service Function Chains Across the Globe with AWS","2023","ICPE 2023 - Proceedings of the 2023 ACM/SPEC International Conference on Performance Engineering","","","","125","135","10","5","10.1145/3578244.3583722","https://www.scopus.com/inward/record.uri?eid=2-s2.0-85158117083&doi=10.1145%2f3578244.3583722&partnerID=40&md5=d56f60ff9f666f315e1f48b78fe34f5c","Conference paper","Final","","Scopus","2-s2.0-85158117083"
"Sumeet N.; Rawat K.; Nambiar M.","Sumeet, Nupur (57223025982); Rawat, Karan (57807606400); Nambiar, Manoj (24833362900)","57223025982; 57807606400; 24833362900","Performance Evaluation of GraphCore IPU-M2000 Accelerator for Text Detection Application","2022","ICPE 2022 - Companion of the 2022 ACM/SPEC International Conference on Performance Engineering","","","","145","152","7","2","10.1145/3491204.3527469","https://www.scopus.com/inward/record.uri?eid=2-s2.0-85136062776&doi=10.1145%2f3491204.3527469&partnerID=40&md5=8d3333b2480b354957926bf6ee151a84","Conference paper","Final","","Scopus","2-s2.0-85136062776"
"Rozanec J.; Nemec P.; Leban G.; Grobelnik M.","Rozanec, Joze (57217150010); Nemec, Peter (58241782600); Leban, Gregor (8961505200); Grobelnik, Marko (57050676100)","57217150010; 58241782600; 8961505200; 57050676100","AI, What Does the Future Hold for Us? Automating Strategic Foresight","2023","ICPE 2023 - Companion of the 2023 ACM/SPEC International Conference on Performance Engineering","","","","247","248","1","2","10.1145/3578245.3585336","https://www.scopus.com/inward/record.uri?eid=2-s2.0-85158904880&doi=10.1145%2f3578245.3585336&partnerID=40&md5=6498107c7d7f13e998fd5de324f3d342","Conference paper","Final","","Scopus","2-s2.0-85158904880"
"Li R.; Du M.; Wang Z.; Chang H.; Mukherjee S.; Eide E.","Li, Richard (57200214277); Du, Min (57213621302); Wang, Zheng (57608023100); Chang, Hyunseok (7407521642); Mukherjee, Sarit (7401816231); Eide, Eric (36871826900)","57200214277; 57213621302; 57608023100; 7407521642; 7401816231; 36871826900","LongTale: Toward Automatic Performance Anomaly Explanation in Microservices","2022","ICPE 2022 - Proceedings of the 2022 ACM/SPEC International Conference on Performance Engineering","","","","5","16","11","6","10.1145/3489525.3511675","https://www.scopus.com/inward/record.uri?eid=2-s2.0-85128632304&doi=10.1145%2f3489525.3511675&partnerID=40&md5=426b6e466df0ea71435c5d782d72e274","Conference paper","Final","","Scopus","2-s2.0-85128632304"
"Koziolek H.; Eskandani N.","Koziolek, Heiko (55884029900); Eskandani, Nafise (57212475750)","55884029900; 57212475750","Lightweight Kubernetes Distributions: A Performance Comparison of MicroK8s, k3s, k0s, and Microshift","2023","ICPE 2023 - Proceedings of the 2023 ACM/SPEC International Conference on Performance Engineering","","","","17","29","12","26","10.1145/3578244.3583737","https://www.scopus.com/inward/record.uri?eid=2-s2.0-85158142647&doi=10.1145%2f3578244.3583737&partnerID=40&md5=b5ac0d53faa09ecfeabcd81fcc17b655","Conference paper","Final","","Scopus","2-s2.0-85158142647"
"Di Pompeo D.; Tucci M.","Di Pompeo, Daniele (57188727238); Tucci, Michele (55317706000)","57188727238; 55317706000","8th Workshop on Challenges in Performance Methods for Software Development: WOSP-C'23 Chairs' Welcome","2023","ICPE 2023 - Companion of the 2023 ACM/SPEC International Conference on Performance Engineering","","","","369","","","0","10.1145/3578245.3584847","https://www.scopus.com/inward/record.uri?eid=2-s2.0-85158842622&doi=10.1145%2f3578245.3584847&partnerID=40&md5=179a75031f972ded7796d53ad9e74c8c","Editorial","Final","","Scopus","2-s2.0-85158842622"
"Karamollahi M.; Williamson C.; Arlitt M.","Karamollahi, Mehdi (57197791940); Williamson, Carey (35614873700); Arlitt, Martin (6701329675)","57197791940; 35614873700; 6701329675","Packet-Level Analysis of Zoom Performance Anomalies","2023","ICPE 2023 - Proceedings of the 2023 ACM/SPEC International Conference on Performance Engineering","","","","221","232","11","2","10.1145/3578244.3583725","https://www.scopus.com/inward/record.uri?eid=2-s2.0-85151297932&doi=10.1145%2f3578244.3583725&partnerID=40&md5=bd29b5224ac4f4ae2eb4919cfbfcdfa8","Conference paper","Final","","Scopus","2-s2.0-85151297932"
"Bulej L.; Horký V.; Tucci M.; Tuma P.; Farquet F.; Leopoldseder D.; Prokopec A.","Bulej, Lubomír (8243498700); Horký, Vojtech (57194446578); Tucci, Michele (55317706000); Tuma, Petr (57050416200); Farquet, François (57217046715); Leopoldseder, David (57076913500); Prokopec, Aleksandar (35203662600)","8243498700; 57194446578; 55317706000; 57050416200; 57217046715; 57076913500; 35203662600","GraalVM Compiler Benchmark Results Dataset (Data Artifact)","2023","ICPE 2023 - Companion of the 2023 ACM/SPEC International Conference on Performance Engineering","","","","65","69","4","0","10.1145/3578245.3585025","https://www.scopus.com/inward/record.uri?eid=2-s2.0-85158838016&doi=10.1145%2f3578245.3585025&partnerID=40&md5=ed38e380ded21f18c0f903e14ebe0de3","Conference paper","Final","All Open Access; Hybrid Gold Open Access","Scopus","2-s2.0-85158838016"
"Lesoil L.; Acher M.; Blouin A.; Jezequel J.-M.","Lesoil, Luc (57222037142); Acher, Mathieu (35758465800); Blouin, Arnaud (23134699800); Jezequel, Jean-Marc (35618077100)","57222037142; 35758465800; 23134699800; 35618077100","Beware of the Interactions of Variability Layers When Reasoning about Evolution of MongoDB","2022","ICPE 2022 - Companion of the 2022 ACM/SPEC International Conference on Performance Engineering","","","","39","43","4","1","10.1145/3491204.3527489","https://www.scopus.com/inward/record.uri?eid=2-s2.0-85136034644&doi=10.1145%2f3491204.3527489&partnerID=40&md5=caeefdef1b4a30794d69132e4614662c","Conference paper","Final","All Open Access; Green Open Access","Scopus","2-s2.0-85136034644"
"Russo Russo G.","Russo Russo, Gabriele (57211560923)","57211560923","Using Reinforcement Learning to Control Auto-Scaling of Distributed Applications","2023","ICPE 2023 - Companion of the 2023 ACM/SPEC International Conference on Performance Engineering","","","","137","138","1","0","10.1145/3578245.3585427","https://www.scopus.com/inward/record.uri?eid=2-s2.0-85158911445&doi=10.1145%2f3578245.3585427&partnerID=40&md5=7ed21b2ae284744a8b5e20269e9ca2f8","Conference paper","Final","","Scopus","2-s2.0-85158911445"
"Farah P.R.; Vergilio S.R.","Farah, Paulo Roberto (56516640700); Vergilio, Silvia Regina (6506290092)","56516640700; 6506290092","PerfoRT: A Tool for Software Performance Regression","2023","ICPE 2023 - Companion of the 2023 ACM/SPEC International Conference on Performance Engineering","","","","119","120","1","0","10.1145/3578245.3584928","https://www.scopus.com/inward/record.uri?eid=2-s2.0-85158856025&doi=10.1145%2f3578245.3584928&partnerID=40&md5=5527b1aa4b0fceeb0fa4e28c570ea623","Conference paper","Final","","Scopus","2-s2.0-85158856025"
"Chetoui S.; Chen M.; Golas A.; Hijaz F.; Belouchrani A.; Reda S.","Chetoui, Sofiane (57210106930); Chen, Michael (57608554900); Golas, Abhinav (26531106300); Hijaz, Farrukh (36699670000); Belouchrani, Adel (7003311350); Reda, Sherief (6701708171)","57210106930; 57608554900; 26531106300; 36699670000; 7003311350; 6701708171","Alternating Blind Identification of Power Sources for Mobile SoCs","2022","ICPE 2022 - Proceedings of the 2022 ACM/SPEC International Conference on Performance Engineering","","","","153","164","11","0","10.1145/3489525.3511676","https://www.scopus.com/inward/record.uri?eid=2-s2.0-85128687311&doi=10.1145%2f3489525.3511676&partnerID=40&md5=2adf753f023fea1a6cc74bc29987503c","Conference paper","Final","","Scopus","2-s2.0-85128687311"
"Nemec P.; Leban G.; Rozanec J.; Grobelnik M.","Nemec, Peter (58241782600); Leban, Gregor (8961505200); Rozanec, Joze (57217150010); Grobelnik, Marko (57050676100)","58241782600; 8961505200; 57217150010; 57050676100","Semi-Supervised Event Predictions with Graph Networks","2023","ICPE 2023 - Companion of the 2023 ACM/SPEC International Conference on Performance Engineering","","","","245","246","1","0","10.1145/3578245.3585332","https://www.scopus.com/inward/record.uri?eid=2-s2.0-85158822496&doi=10.1145%2f3578245.3585332&partnerID=40&md5=fd6c281cf1e3198b12ba26b7187480be","Conference paper","Final","","Scopus","2-s2.0-85158822496"
"Chu X.; Talluri S.; Versluis L.; Iosup A.","Chu, Xiaoyu (58242020700); Talluri, Sacheendra (57200562502); Versluis, Laurens (57203221723); Iosup, Alexandru (23392350500)","58242020700; 57200562502; 57203221723; 23392350500","How Do ML Jobs Fail in Datacenters? Analysis of a Long-Term Dataset from an HPC Cluster","2023","ICPE 2023 - Companion of the 2023 ACM/SPEC International Conference on Performance Engineering","","","","263","268","5","1","10.1145/3578245.3584726","https://www.scopus.com/inward/record.uri?eid=2-s2.0-85158836930&doi=10.1145%2f3578245.3584726&partnerID=40&md5=333785020d1293c96e5223129bfd192b","Conference paper","Final","All Open Access; Bronze Open Access","Scopus","2-s2.0-85158836930"
"He S.; Kim I.K.; Wang W.","He, Sen (59825690100); Kim, In Kee (56027159500); Wang, Wei (56948511500)","59825690100; 56027159500; 56948511500","A Study of Java Microbenchmark Tail Latencies","2023","ICPE 2023 - Companion of the 2023 ACM/SPEC International Conference on Performance Engineering","","","","77","81","4","0","10.1145/3578245.3584690","https://www.scopus.com/inward/record.uri?eid=2-s2.0-85158848642&doi=10.1145%2f3578245.3584690&partnerID=40&md5=6be0e6fde5877ab227e3f9d085cb37e7","Conference paper","Final","","Scopus","2-s2.0-85158848642"
"Rozanec J.; Cochez M.; Van Bakel R.; Elvesæter B.; Roman D.","Rozanec, Joze (57217150010); Cochez, Michael (55814163300); Van Bakel, Ruud (57192832521); Elvesæter, Brian (14832681400); Roman, Dumitru (23467687800)","57217150010; 55814163300; 57192832521; 14832681400; 23467687800","Graph-Scrutinizer: Towards Massive Graph Analytics and Reasoning","2023","ICPE 2023 - Companion of the 2023 ACM/SPEC International Conference on Performance Engineering","","","","251","252","1","0","10.1145/3578245.3585338","https://www.scopus.com/inward/record.uri?eid=2-s2.0-85158847276&doi=10.1145%2f3578245.3585338&partnerID=40&md5=5051793d5b43fe1a74d3a9e892fccc18","Conference paper","Final","All Open Access; Green Open Access","Scopus","2-s2.0-85158847276"
"","","","ICPE 2023 - Proceedings of the 2023 ACM/SPEC International Conference on Performance Engineering","2023","ICPE 2023 - Proceedings of the 2023 ACM/SPEC International Conference on Performance Engineering","","","","","","242","0","","https://www.scopus.com/inward/record.uri?eid=2-s2.0-85158150919&partnerID=40&md5=e827bb8db7f565642d820d5acffaff52","Conference review","Final","","Scopus","2-s2.0-85158150919"
"Li Y.; Gupta A.; Yang A.; Chen P.; Pinto J.; Karrer B.; Pundir M.; Balandat M.; Kejariwal A.; Lee B.","Li, Yuhao (57215668938); Gupta, Abhishek (57198677047); Yang, Alex (58236567700); Chen, Peinan (58238021000); Pinto, Joey (58237290600); Karrer, Brian (24171042900); Pundir, Mayank (54403600100); Balandat, Maximilian (37057184000); Kejariwal, Arun (56108398400); Lee, Benjamin (56748229700)","57215668938; 57198677047; 58236567700; 58238021000; 58237290600; 24171042900; 54403600100; 37057184000; 56108398400; 56748229700","HHVM Performance Optimization for Large Scale Web Services","2023","ICPE 2023 - Proceedings of the 2023 ACM/SPEC International Conference on Performance Engineering","","","","137","148","11","1","10.1145/3578244.3583720","https://www.scopus.com/inward/record.uri?eid=2-s2.0-85158128302&doi=10.1145%2f3578244.3583720&partnerID=40&md5=6663b91b82b4679783f6f1cf277f9676","Conference paper","Final","","Scopus","2-s2.0-85158128302"
"Beck S.; Frank S.; Hakamian A.; Van Hoorn A.","Beck, Samuel (57217046218); Frank, Sebastian (57199323345); Hakamian, Alireza (57209100907); Van Hoorn, Andre (26421837600)","57217046218; 57199323345; 57209100907; 26421837600","How is transient behavior addressed in practice? Insights from a series of expert interviews","2022","ICPE 2022 - Companion of the 2022 ACM/SPEC International Conference on Performance Engineering","","","","105","112","7","2","10.1145/3491204.3527483","https://www.scopus.com/inward/record.uri?eid=2-s2.0-85136001795&doi=10.1145%2f3491204.3527483&partnerID=40&md5=aabdf48b7a21a3e36835f1715991509e","Conference paper","Final","","Scopus","2-s2.0-85136001795"
"Marbukh V.","Marbukh, Vladimir (6603887859)","6603887859","Towards Evaluation/Mitigation Risk of Systemic Failures in a Recoverable Network with Redistributed Elastic Load","2023","ICPE 2023 - Companion of the 2023 ACM/SPEC International Conference on Performance Engineering","","","","115","116","1","0","10.1145/3578245.3584926","https://www.scopus.com/inward/record.uri?eid=2-s2.0-85158903337&doi=10.1145%2f3578245.3584926&partnerID=40&md5=6e953659677960b861938047d584bcf3","Conference paper","Final","","Scopus","2-s2.0-85158903337"
"Domaschka J.; Volpert S.; Maier K.; Eisenhart G.; Seybold D.","Domaschka, Jörg (14041782200); Volpert, Simon (57196346652); Maier, Kevin (58241995100); Eisenhart, Georg (57206486412); Seybold, Daniel (57189073951)","14041782200; 57196346652; 58241995100; 57206486412; 57189073951","Using eBPF for Database Workload Tracing: An Explorative Study","2023","ICPE 2023 - Companion of the 2023 ACM/SPEC International Conference on Performance Engineering","","","","311","317","6","2","10.1145/3578245.3584313","https://www.scopus.com/inward/record.uri?eid=2-s2.0-85158911918&doi=10.1145%2f3578245.3584313&partnerID=40&md5=adaa75ea2afbc2495e61b7f6823cc889","Conference paper","Final","All Open Access; Bronze Open Access","Scopus","2-s2.0-85158911918"
"Podelko A.","Podelko, Alexander (55550590800)","55550590800","Views From the Trenches: Current Trends in Performance Engineering","2023","ICPE 2023 - Companion of the 2023 ACM/SPEC International Conference on Performance Engineering","","","","357","359","2","0","10.1145/3578245.3584355","https://www.scopus.com/inward/record.uri?eid=2-s2.0-85158816137&doi=10.1145%2f3578245.3584355&partnerID=40&md5=7a714f716e54497cdfad404c5a427b11","Conference paper","Final","All Open Access; Bronze Open Access","Scopus","2-s2.0-85158816137"
"Iosup A.; Prodan R.","Iosup, Alexandru (23392350500); Prodan, Radu (8858675500)","23392350500; 8858675500","ICPE'23 GraphSys Workshop Chairs Introduction (Welcome)","2023","ICPE 2023 - Companion of the 2023 ACM/SPEC International Conference on Performance Engineering","","","","207","208","1","0","10.1145/3578245.3585328","https://www.scopus.com/inward/record.uri?eid=2-s2.0-85158862387&doi=10.1145%2f3578245.3585328&partnerID=40&md5=e7529ceefad3c20ac52da2ef3cbfb45a","Editorial","Final","","Scopus","2-s2.0-85158862387"
"Woodside M.","Woodside, Murray (57203998004)","57203998004","Heuristic Derivation of a Fluid Model from a Layered Queueing Network","2023","ICPE 2023 - Companion of the 2023 ACM/SPEC International Conference on Performance Engineering","","","","389","395","6","1","10.1145/3578245.3584852","https://www.scopus.com/inward/record.uri?eid=2-s2.0-85158863234&doi=10.1145%2f3578245.3584852&partnerID=40&md5=3c1dd9bbab02b4e0016a336d82fa3cb5","Conference paper","Final","","Scopus","2-s2.0-85158863234"
"Molan M.; Ahmed Khan J.; Borghesi A.; Bartolini A.","Molan, Martin (57224202282); Ahmed Khan, Junaid (58551803200); Borghesi, Andrea (56154931300); Bartolini, Andrea (57216775622)","57224202282; 58551803200; 56154931300; 57216775622","Graph Neural Networks for Anomaly Anticipation in HPC Systems","2023","ICPE 2023 - Companion of the 2023 ACM/SPEC International Conference on Performance Engineering","","","","239","244","5","7","10.1145/3578245.3585335","https://www.scopus.com/inward/record.uri?eid=2-s2.0-85158852071&doi=10.1145%2f3578245.3585335&partnerID=40&md5=b74bd87230c12aefdba8f864834a5ab7","Conference paper","Final","All Open Access; Bronze Open Access","Scopus","2-s2.0-85158852071"
"Jansen M.; Donkervliet J.; Trivedi A.; Iosup A.","Jansen, Matthijs (57211621736); Donkervliet, Jesse (56377366500); Trivedi, Animesh (55014115500); Iosup, Alexandru (23392350500)","57211621736; 56377366500; 55014115500; 23392350500","Can My WiFi Handle the Metaverse? A Performance Evaluation Of Meta's Flagship Virtual Reality Hardware","2023","ICPE 2023 - Companion of the 2023 ACM/SPEC International Conference on Performance Engineering","","","","297","303","6","14","10.1145/3578245.3585022","https://www.scopus.com/inward/record.uri?eid=2-s2.0-85158874366&doi=10.1145%2f3578245.3585022&partnerID=40&md5=4e3ff68012efbfd0863de5751e3d8531","Conference paper","Final","All Open Access; Bronze Open Access","Scopus","2-s2.0-85158874366"
"Galimberti E.; Guindani B.; Filippini F.; Sedghani H.; Ardagna D.; Moltó G.; Caballer M.","Galimberti, Enrico (58241772100); Guindani, Bruno (57712327500); Filippini, Federica (57222342275); Sedghani, Hamta (57232110300); Ardagna, Danilo (6508040906); Moltó, Germán (8953108200); Caballer, Miguel (22733776500)","58241772100; 57712327500; 57222342275; 57232110300; 6508040906; 8953108200; 22733776500","OSCAR-P and aMLLibrary: Performance Profiling and Prediction of Computing Continua Applications","2023","ICPE 2023 - Companion of the 2023 ACM/SPEC International Conference on Performance Engineering","","","","139","146","7","9","10.1145/3578245.3584941","https://www.scopus.com/inward/record.uri?eid=2-s2.0-85158883808&doi=10.1145%2f3578245.3584941&partnerID=40&md5=8a719865ca3f15d482ca499b163d5c51","Conference paper","Final","All Open Access; Bronze Open Access","Scopus","2-s2.0-85158883808"
"Tonini S.; Barsacchi F.; Chiaromonte F.; Licari D.; Vandin A.","Tonini, Simone (57845875400); Barsacchi, Fernando (58241547100); Chiaromonte, Francesca (6701346995); Licari, Daniele (55082143500); Vandin, Andrea (36662971300)","57845875400; 58241547100; 6701346995; 55082143500; 36662971300","Towards Novel Statistical Methods for Anomaly Detection in Industrial Processes","2023","ICPE 2023 - Companion of the 2023 ACM/SPEC International Conference on Performance Engineering","","","","147","153","6","0","10.1145/3578245.3585036","https://www.scopus.com/inward/record.uri?eid=2-s2.0-85158857889&doi=10.1145%2f3578245.3585036&partnerID=40&md5=56c91d34182a7512538713b9c395f867","Conference paper","Final","All Open Access; Green Open Access","Scopus","2-s2.0-85158857889"
"Somashekar G.; Kumar R.","Somashekar, Gagan (57213267316); Kumar, Rajat (58188873600)","57213267316; 58188873600","Enhancing the Configuration Tuning Pipeline of Large-Scale Distributed Applications Using Large Language Models (Idea Paper)","2023","ICPE 2023 - Companion of the 2023 ACM/SPEC International Conference on Performance Engineering","","","","39","44","5","7","10.1145/3578245.3585032","https://www.scopus.com/inward/record.uri?eid=2-s2.0-85158859428&doi=10.1145%2f3578245.3585032&partnerID=40&md5=df78987a01149871fe9a149f2c8053df","Conference paper","Final","","Scopus","2-s2.0-85158859428"
"Kousiouris G.; Ambroziak S.; Zarzycki B.; Costantino D.; Tsarsitalidis S.; Katevas V.; Mamelli A.; Stamati T.","Kousiouris, George (26031026200); Ambroziak, Szymon (57476220200); Zarzycki, Blazej (58242673000); Costantino, Domenico (57476070300); Tsarsitalidis, Stylianos (57209306915); Katevas, Vasileios (58242673100); Mamelli, Alessandro (23470097100); Stamati, Teta (6506964629)","26031026200; 57476220200; 58242673000; 57476070300; 57209306915; 58242673100; 23470097100; 6506964629","A Pattern-based Function and Workflow Visual Environment for FaaS Development across the Continuum","2023","ICPE 2023 - Companion of the 2023 ACM/SPEC International Conference on Performance Engineering","","","","165","172","7","5","10.1145/3578245.3584934","https://www.scopus.com/inward/record.uri?eid=2-s2.0-85158828920&doi=10.1145%2f3578245.3584934&partnerID=40&md5=a997be3ce0ca8e29fe3910c598ec139b","Conference paper","Final","All Open Access; Hybrid Gold Open Access","Scopus","2-s2.0-85158828920"
